PT	AU	BA	CA	GP	RI	OI	BE	Z2	TI	X1	Y1	Z1	FT	PN	AE	Z3	SO	S1	SE	BS	VL	IS	SI	MA	BP	EP	AR	DI	D2	SU	PD	PY	AB	X4	Y4	Z4	AK	CT	CY	SP	CL	TC	Z8	ZB	ZS	Z9	SN	BN	UT	PM
J	Iwasa, Yukikazu; Hahn, Seungyong								First-cut design of an all-superconducting 100-T direct current magnet								APPLIED PHYSICS LETTERS				103	25					253507	10.1063/1.4852596			DEC 16 2013	2013										16							WOS:000329973800094		
J	Chang, J.; Mansson, M.; Pailhes, S.; Claesson, T.; Lipscombe, O. J.; Hayden, S. M.; Patthey, L.; Tjernberg, O.; Mesot, J.								Anisotropic breakdown of Fermi liquid quasiparticle excitations in overdoped La2-xSrxCuO4								NATURE COMMUNICATIONS				4						2559	10.1038/ncomms3559			OCT 2013	2013										16							WOS:000326470400003		
J	Sobota, J. A.; Kim, K.; Takatsu, H.; Hashimoto, M.; Mo, S. -K.; Hussain, Z.; Oguchi, T.; Shishidou, T.; Maeno, Y.; Min, B. I.; Shen, Z. -X.								Electronic structure of the metallic antiferromagnet PdCrO2 measured by angle-resolved photoemission spectroscopy								PHYSICAL REVIEW B				88	12					125109	10.1103/PhysRevB.88.125109			SEP 5 2013	2013										16							WOS:000324051700006		
J	Milbradt, S.; Bardin, A. A.; Truncik, C. J. S.; Huttema, W. A.; Jacko, A. C.; Burn, P. L.; Lo, S. -C.; Powell, B. J.; Broun, D. M.								In-plane superfluid density and microwave conductivity of the organic superconductor kappa-(BEDT-TTF)(2)Cu[N(CN)(2)]Br: Evidence for d-wave pairing and resilient quasiparticles								PHYSICAL REVIEW B				88	6					064501	10.1103/PhysRevB.88.064501			AUG 7 2013	2013										16							WOS:000322812700002		
J	Korovin, Yegor; Skenderis, Kostas; Taylor, Marika								Lifshitz as a deformation of Anti-de Sitter								JOURNAL OF HIGH ENERGY PHYSICS					8					026	10.1007/JHEP08(2013)026			AUG 2013	2013										16							WOS:000324113700026		
J	Tallon, J. L.; Barber, F.; Storey, J. G.; Loram, J. W.								Coexistence of the superconducting energy gap and pseudogap above and below the transition temperature of cuprate superconductors								PHYSICAL REVIEW B				87	14					140508	10.1103/PhysRevB.87.140508			APR 29 2013	2013										16							WOS:000318510100002		
J	Huecker, M.								Structural aspects of materials with static stripe order								PHYSICA C-SUPERCONDUCTIVITY AND ITS APPLICATIONS				481				3	14		10.1016/j.physc.2012.04.035			NOV 2012	2012										16							WOS:000308711800002		
J	Tranquada, John M.								Stripes and superconductivity in cuprates								PHYSICA B-CONDENSED MATTER				407	11			1771	1774		10.1016/j.physb.2012.01.026			JUN 1 2012	2012						International Workshop on Electronic Crystals (ECRYS)	AUG 15-27, 2011		CNRS, Inst Etudes Scientifiques, Cargese, FRANCE	16							WOS:000303415000023		
J	Huang, W.; Pacradouni, V.; Kennett, M. P.; Komiya, S.; Sonier, J. E.								Precision search for magnetic order in the pseudogap regime of La2-xSrxCuO4 by muon spin relaxation								PHYSICAL REVIEW B				85	10					104527	10.1103/PhysRevB.85.104527			MAR 30 2012	2012										16							WOS:000302170200007		
J	Li, Lu; Alidoust, N.; Tranquada, J. M.; Gu, G. D.; Ong, N. P.								Unusual Nernst Effect Suggesting Time-Reversal Violation in the Striped Cuprate Superconductor La2-xBaxCuO4								PHYSICAL REVIEW LETTERS				107	27					277001	10.1103/PhysRevLett.107.277001			DEC 27 2011	2011										16							WOS:000298609900011		
J	Huber, Sebastian D.; Lindner, Netanel H.								Topological transitions for lattice bosons in a magnetic field								PROCEEDINGS OF THE NATIONAL ACADEMY OF SCIENCES OF THE UNITED STATES OF AMERICA				108	50			19925	19930		10.1073/pnas.1110813108			DEC 13 2011	2011										16							WOS:000298034800025		
J	Ghannadzadeh, S.; Coak, M.; Franke, I.; Goddard, P. A.; Singleton, J.; Manson, J. L.								Measurement of magnetic susceptibility in pulsed magnetic fields using a proximity detector oscillator								REVIEW OF SCIENTIFIC INSTRUMENTS				82	11					113902	10.1063/1.3653395			NOV 2011	2011										16							WOS:000297941100034		
J	Krasnov, V. M.; Motzkau, H.; Golod, T.; Rydh, A.; Katterwe, S. O.; Kulakov, A. B.								Comparative analysis of tunneling magnetoresistance in low-T-c Nb/Al-AlOx/Nb and high-T-c Bi2-yPbySr2CaCu2O8+delta intrinsic Josephson junctions								PHYSICAL REVIEW B				84	5					054516	10.1103/PhysRevB.84.054516			AUG 9 2011	2011										16							WOS:000293702000010		
J	Malone, Liam; Matusda, Tatsuma D.; Antunes, Arlei; Knebel, Georg; Taufour, Valentin; Aoki, Dai; Behnia, Kamran; Proust, Cyril; Flouquet, Jacques								Thermoelectric evidence for high-field anomalies in the hidden order phase of URu2Si2								PHYSICAL REVIEW B				83	24					245117	10.1103/PhysRevB.83.245117			JUN 22 2011	2011										16							WOS:000291935300004		
J	Moon, S. J.; Homes, C. C.; Akrap, A.; Xu, Z. J.; Wen, J. S.; Lin, Z. W.; Li, Q.; Gu, G. D.; Basov, D. N.								Incoherent c-Axis Interplane Response of the Iron Chalcogenide FeTe0.55Se0.45 Superconductor from Infrared Spectroscopy								PHYSICAL REVIEW LETTERS				106	21					217001	10.1103/PhysRevLett.106.217001			MAY 23 2011	2011										16							WOS:000290859600012		
J	Seibold, G.; Markiewicz, R. S.; Lorenzana, J.								Spin canting as a result of the competition between stripes and spirals in cuprates								PHYSICAL REVIEW B				83	20					205108	10.1103/PhysRevB.83.205108			MAY 17 2011	2011										16							WOS:000290714800003		
J	Kondrat, Agnieszka; Behr, Guenter; Buechner, Bernd; Hess, Christian								Unusual Nernst effect and spin density wave precursors in superconducting LaFeAsO1-xFx								PHYSICAL REVIEW B				83	9					092507	10.1103/PhysRevB.83.092507			MAR 28 2011	2011										16							WOS:000288854300002		
J	Saadaoui, H.; Morris, G. D.; Salman, Z.; Song, Q.; Chow, K. H.; Hossain, M. D.; Levy, C. D. P.; Parolin, T. J.; Pearson, M. R.; Smadella, M.; Wang, D.; Greene, L. H.; Hentges, P. J.; Kiefl, R. F.; MacFarlane, W. A.								Search for broken time-reversal symmetry near the surface of superconducting YBa2Cu3O7-delta films using beta-detected nuclear magnetic resonance								PHYSICAL REVIEW B				83	5					054504	10.1103/PhysRevB.83.054504			FEB 9 2011	2011										16							WOS:000287129700009		
J	Chakraborty, Shiladitya; Galanakis, Dimitrios; Phillips, Philip								Emergence of particle-hole symmetry near optimal doping in high-temperature copper oxide superconductors								PHYSICAL REVIEW B				82	21					214503	10.1103/PhysRevB.82.214503			DEC 3 2010	2010										16							WOS:000286740300005		
J	Markiewicz, R. S.; Das, Tanmoy; Bansil, A.								Failure of t-J models in describing doping evolution of spectral weight in x-ray scattering, optical, and photoemission spectra of cuprates								PHYSICAL REVIEW B				82	22					224501	10.1103/PhysRevB.82.224501			DEC 1 2010	2010										16							WOS:000286752700004		
J	Lambacher, M.; Helm, T.; Kartsovnik, M.; Erb, A.								Advances in single crystal growth and annealing treatment of electron-doped HTSC								EUROPEAN PHYSICAL JOURNAL-SPECIAL TOPICS				188	1			61	72		10.1140/epjst/e2010-01297-8			OCT 2010	2010										16							WOS:000283362000006		
J	Kotetes, P.; Varelogiannis, G.								Chirality Induced Tilted-Hill Giant Nernst Signal								PHYSICAL REVIEW LETTERS				104	10					106404	10.1103/PhysRevLett.104.106404			MAR 12 2010	2010										16							WOS:000275543500038		
J	Johnston, S.; Lee, W. S.; Chen, Y.; Nowadnick, E. A.; Moritz, B.; Shen, Z. -X.; Devereaux, T. P.								Material and Doping Dependence of the Nodal and Antinodal Dispersion Renormalizations in Single- and Multilayer Cuprates								ADVANCES IN CONDENSED MATTER PHYSICS										968304	10.1155/2010/968304			2010	2010										16							WOS:000294023600001		
J	Millis, A. J.								Fluctuation-driven first-order behavior near the T=0 two-dimensional stripe to Fermi liquid transition								PHYSICAL REVIEW B				81	3					035117	10.1103/PhysRevB.81.035117			JAN 2010	2010										16							WOS:000274002300042		
J	Okawa, M.; Ishizaka, K.; Uchiyama, H.; Tadatomo, H.; Masui, T.; Tajima, S.; Wang, X. -Y.; Chen, C. -T.; Watanabe, S.; Chainani, A.; Saitoh, T.; Shin, S.								Superconducting electronic state in optimally doped YBa2Cu3O7-delta observed with laser-excited angle-resolved photoemission spectroscopy								PHYSICAL REVIEW B				79	14					144528	10.1103/PhysRevB.79.144528			APR 2009	2009										16							WOS:000265943200125		
J	Poilblanc, Didier								Properties of holons in the quantum dimer model								PHYSICAL REVIEW LETTERS				100	15					157206	10.1103/PhysRevLett.100.157206			APR 18 2008	2008										16							WOS:000255117800066		
J	Melikyan, Ashot; Tesanovic, Zlatko								Dirac-Bogoliubov-deGennes quasiparticles in a vortex lattice								PHYSICAL REVIEW B				76	9					094509	10.1103/PhysRevB.76.094509			SEP 2007	2007										16							WOS:000249786100079		
J	Amoretti, Andrea; Arean, Daniel; Gouteraux, Blaise; Musso, Daniele								Effective holographic theory of charge density waves								PHYSICAL REVIEW D				97	8					086017	10.1103/PhysRevD.97.086017			APR 27 2018	2018										15							WOS:000432961200013		
J	Perez-Munoz, Ana M.; Schio, Pedro; Poloni, Roberta; Fernandez-Martinez, Alejandro; Rivera-Calzada, Alberto; Cezar, Julio C.; Salas-Colera, Eduardo; Castro, German R.; Kinney, Joseph; Leon, Carlos; Santamaria, Jacobo; Garcia-Barriocanal, Javier; Goldman, Allen M.								In operando evidence of deoxygenation in ionic liquid gating of YBa2Cu3O7-X								PROCEEDINGS OF THE NATIONAL ACADEMY OF SCIENCES OF THE UNITED STATES OF AMERICA				114	2			215	220		10.1073/pnas.1613006114			JAN 10 2017	2017										15							WOS:000391439300028		
J	Ying, T. P.; Lai, X. F.; Hong, X. C.; Xu, Y.; He, L. P.; Zhang, J.; Wang, M. X.; Yu, Y. J.; Huang, F. Q.; Li, S. Y.								Nodal superconductivity in FeS: Evidence from quasiparticle heat transport								PHYSICAL REVIEW B				94	10					100504	10.1103/PhysRevB.94.100504			SEP 29 2016	2016										15							WOS:000384376400002		
J	Kloss, T.; Montiel, X.; de Carvalho, V. S.; Freire, H.; Pepin, C.								Charge orders, magnetism and pairings in the cuprate superconductors								REPORTS ON PROGRESS IN PHYSICS				79	8					084507	10.1088/0034-4885/79/8/084507			AUG 2016	2016										15							WOS:000383956000008		
J	Fechner, M.; Fierz, M. J. A.; Thole, F.; Staub, U.; Spaldin, N. A.								Quasistatic magnetoelectric multipoles as order parameter for pseudogap phase in cuprate superconductors								PHYSICAL REVIEW B				93	17					174419	10.1103/PhysRevB.93.174419			MAY 20 2016	2016										15							WOS:000376246400003		
J	Wu, Jie; Bollinger, Anthony T.; Sun, Yujie; Bozovic, Ivan								Hall effect in quantum critical charge-cluster glass								PROCEEDINGS OF THE NATIONAL ACADEMY OF SCIENCES OF THE UNITED STATES OF AMERICA				113	16			4284	4289		10.1073/pnas.1519630113			APR 19 2016	2016										15							WOS:000374393800033		
J	Jang, Hyewon								Identifying 21st Century STEM Competencies Using Workplace Data								JOURNAL OF SCIENCE EDUCATION AND TECHNOLOGY				25	2			284	301		10.1007/s10956-015-9593-1			APR 2016	2016										15							WOS:000372284100011		
J	Shi, Q.; Zudov, M. A.; Watson, J. D.; Gardner, G. C.; Manfra, M. J.								Reorientation of quantum Hall stripes within a partially filled Landau level								PHYSICAL REVIEW B				93	12					121404	10.1103/PhysRevB.93.121404			MAR 14 2016	2016										15							WOS:000372411700003		
J	Aleven, Vincent; McLaren, Bruce M.; Sewall, Jonathan; van Velsen, Martin; Popescu, Octav; Demi, Sandra; Ringenberg, Michael; Koedinger, Kenneth R.								Example-Tracing Tutors: Intelligent Tutor Development for Non-programmers								INTERNATIONAL JOURNAL OF ARTIFICIAL INTELLIGENCE IN EDUCATION				26	1			224	269		10.1007/s40593-015-0088-2			MAR 2016	2016										15							WOS:000377379100019		
J	Feng, Yejun; van Wezel, Jasper; Wang, Jiyang; Flicker, Felix; Silevitch, D. M.; Littlewood, P. B.; Rosenbaum, T. F.								Itinerant density wave instabilities at classical and quantum critical points								NATURE PHYSICS				11	10			865	871		10.1038/NPHYS3416			OCT 2015	2015										15							WOS:000362188600024		
J	Dakovski, Georgi L.; Lee, Wei-Sheng; Hawthorn, David G.; Garner, Niklas; Bonn, Doug; Hardy, Walter; Liang, Ruixing; Hoffmann, Matthias C.; Turner, Joshua J.								Enhanced coherent oscillations in the superconducting state of underdoped YBa2Cu3O6+x induced via ultrafast terahertz excitation								PHYSICAL REVIEW B				91	22					220506	10.1103/PhysRevB.91.220506			JUN 24 2015	2015										15							WOS:000356791700002		
J	Dzero, Maxim; Khodas, Maxim; Levchenko, Alex								Amplitude modes and dynamic coexistence of competing orders in multicomponent superconductors								PHYSICAL REVIEW B				91	21					214505	10.1103/PhysRevB.91.214505			JUN 10 2015	2015										15							WOS:000355956100001		
J	Varma, C. M.								Pseudogap in cuprates in the loop-current ordered state								JOURNAL OF PHYSICS-CONDENSED MATTER				26	50					505701	10.1088/0953-8984/26/50/505701			DEC 17 2014	2014										15							WOS:000345461700016		
J	Volkova, Nadezhda E.; Lebedev, Oleg I.; Gavrilova, Ludmila Ya.; Turner, Stuart; Gauquelin, Nicolas; Seikh, Md Motin; Caignaert, Vincent; Cherepanov, Vladimir A.; Raveau, Bernard; Van Tendeloo, Gustaaf								Nanoscale Ordering in Oxygen Deficient Quintuple Perovskite Sm2-epsilon Ba3+epsilon Fe5O15-delta: Implication for Magnetism and Oxygen Stoichiometry								CHEMISTRY OF MATERIALS				26	21			6303	6310		10.1021/cm503276p			NOV 11 2014	2014										15							WOS:000344905600029		
J	Fischer, Mark H.; Wu, Si; Lawler, Michael; Paramekanti, Arun; Kim, Eun-Ah								Nematic and spin-charge orders driven by hole-doping a charge-transfer insulator								NEW JOURNAL OF PHYSICS				16						093057	10.1088/1367-2630/16/9/093057			SEP 30 2014	2014										15							WOS:000344059300006		
J	Poilblanc, Didier; Corboz, Philippe; Schuch, Norbert; Cirac, J. Ignacio								Resonating-valence-bond superconductors with fermionic projected entangled pair states								PHYSICAL REVIEW B				89	24					241106	10.1103/PhysRevB.89.241106			JUN 27 2014	2014										15							WOS:000337944600001		
J	Avella, Adolfo								Composite Operator Method Analysis of the Underdoped Cuprates Puzzle								ADVANCES IN CONDENSED MATTER PHYSICS										515698	10.1155/2014/515698			2014	2014										15							WOS:000345368000001		
J	Hafner, Daniel; Dressel, Martin; Scheffler, Marc								Surface-resistance measurements using superconducting stripline resonators								REVIEW OF SCIENTIFIC INSTRUMENTS				85	1					014702	10.1063/1.4856475			JAN 2014	2014										15							WOS:000331217300056		
J	Koizumi, Hiroyasu; Hidekata, Ryo; Okazaki, Akira; Tachiki, Masashi								Persistent Current Generation by the Spin-Vortex Formation in the Cuprate with the Single-Valuedness Constraint on the Conduction Electron Wave Functions								JOURNAL OF SUPERCONDUCTIVITY AND NOVEL MAGNETISM				27	1			121	132		10.1007/s10948-013-2277-2			JAN 2014	2014										15							WOS:000329655900018		
J	Buhmann, Jonathan M.; Sigrist, Manfred								Thermoelectric effect of correlated metals: Band-structure effects and the breakdown of Mott's formula								PHYSICAL REVIEW B				88	11					115128	10.1103/PhysRevB.88.115128			SEP 16 2013	2013										15							WOS:000324397400004		
J	Grigoriev, P. D.								Longitudinal interlayer magnetoresistance in strongly anisotropic quasi-two-dimensional metals								PHYSICAL REVIEW B				88	5					054415	10.1103/PhysRevB.88.054415			AUG 19 2013	2013										15							WOS:000323328000007		
J	Avella, Adolfo; Mancini, Ferdinando; Mancini, Francesco Paolo; Plekhanov, Evgeny								Emery vs. Hubbard model for cuprate superconductors: a composite operator method study								EUROPEAN PHYSICAL JOURNAL B				86	6					265	10.1140/epjb/e2013-40115-3			JUN 2013	2013										15							WOS:000321446200025		
J	Neto, Eduardo H. da Silva; Aynajian, Pegor; Baumbach, Ryan E.; Bauer, Eric D.; Mydosh, John; Ono, Shimpei; Yazdani, Ali								Detection of electronic nematicity using scanning tunneling microscopy								PHYSICAL REVIEW B				87	16					161117	10.1103/PhysRevB.87.161117			APR 25 2013	2013										15							WOS:000318178600001		
J	Romer, A. T.; Chang, J.; Christensen, N. B.; Andersen, B. M.; Lefmann, K.; Maehler, L.; Gavilano, J.; Gilardi, R.; Niedermayer, Ch.; Ronnow, H. M.; Schneidewind, A.; Link, P.; Oda, M.; Ido, M.; Momono, N.; Mesot, J.								Glassy low-energy spin fluctuations and anisotropy gap in La1.88Sr0.12CuO4								PHYSICAL REVIEW B				87	14					144513	10.1103/PhysRevB.87.144513			APR 22 2013	2013										15							WOS:000317822300015		
J	Wen, Jinsheng; Xu, Zhijun; Xu, Guangyong; Jie, Qing; Huecker, M.; Zheludev, A.; Tian, Wei; Winn, B. L.; Zarestky, J. L.; Singh, D. K.; Hong, Tao; Li, Qiang; Gu, Genda; Tranquada, J. M.								Probing the connections between superconductivity, stripe order, and structure in La1.905Ba0.095Cu1-yZnyO4								PHYSICAL REVIEW B				85	13					134512	10.1103/PhysRevB.85.134512			APR 12 2012	2012										15							WOS:000302696900003		
J	Ofer, Oren; Baglo, J. C.; Hossain, M. D.; Kiefl, R. F.; Hardy, W. N.; Thaler, A.; Kim, H.; Tanatar, M. A.; Canfield, P. C.; Prozorov, R.; Luke, G. M.; Morenzoni, E.; Saadaoui, H.; Suter, A.; Prokscha, T.; Wojek, B. M.; Salman, Z.								Absolute value and temperature dependence of the magnetic penetration depth in Ba(Co0.074Fe0.926)(2)As-2								PHYSICAL REVIEW B				85	6					060506	10.1103/PhysRevB.85.060506			FEB 28 2012	2012										15							WOS:000300830500001		
J	Zabolotnyy, V. B.; Kordyuk, A. A.; Evtushinsky, D.; Strocov, V. N.; Patthey, L.; Schmitt, T.; Haug, D.; Lin, C. T.; Hinkov, V.; Keimer, B.; Buechner, B.; Borisenko, S. V.								Pseudogap in the chain states of YBa2Cu3O6.6								PHYSICAL REVIEW B				85	6					064507	10.1103/PhysRevB.85.064507			FEB 8 2012	2012										15							WOS:000300086500004		
J	Tahir-Kheli, Jamil; Goddard, William A., III								Origin of the Pseudogap in High-Temperature Cuprate Superconductors								JOURNAL OF PHYSICAL CHEMISTRY LETTERS				2	18			2326	2330		10.1021/jz200916t			SEP 15 2011	2011										15							WOS:000295058500011		
J	Headings, N. S.; Hayden, S. M.; Kulda, J.; Babu, N. Hari; Cardwell, D. A.								Spin anisotropy of the magnetic excitations in the normal and superconducting states of optimally doped YBa2Cu3O6.9 studied by polarized neutron spectroscopy								PHYSICAL REVIEW B				84	10					104513	10.1103/PhysRevB.84.104513			SEP 12 2011	2011										15							WOS:000294774800014		
J	Razzoli, E.; Sassa, Y.; Drachuck, G.; Mansson, M.; Keren, A.; Shay, M.; Berntsen, M. H.; Tjernberg, O.; Radovic, M.; Chang, J.; Pailhes, S.; Momono, N.; Oda, M.; Ido, M.; Lipscombe, O. J.; Hayden, S. M.; Patthey, L.; Mesot, J.; Shi, M.								The Fermi surface and band folding in La2-xSrxCuO4, probed by angle-resolved photoemission								NEW JOURNAL OF PHYSICS				12						125003	10.1088/1367-2630/12/12/125003			DEC 6 2010	2010										15							WOS:000285014100001		
J	Liebsch, Ansgar								Spectral weight of doping-induced states in the two-dimensional Hubbard model								PHYSICAL REVIEW B				81	23					235133	10.1103/PhysRevB.81.235133			JUN 29 2010	2010										15							WOS:000279335400001		
J	Charpentier, S.; Roberge, G.; Godin-Proulx, S.; Bechamp-Laganiere, X.; Truong, K. D.; Fournier, P.; Rauwel, P.								Antiferromagnetic fluctuations and the Hall effect of electron-doped cuprates: Possibility of a quantum phase transition at underdoping								PHYSICAL REVIEW B				81	10					104509	10.1103/PhysRevB.81.104509			MAR 2010	2010										15							WOS:000276248700103		
J	Wang, Xin; de' Medici, Luca; Millis, A. J.								Theory of oxygen K edge x-ray absorption spectra of cuprates								PHYSICAL REVIEW B				81	9					094522	10.1103/PhysRevB.81.094522			MAR 1 2010	2010										15							WOS:000276207300111		
J	Riggs, Scott C.; Kemper, J. B.; Jo, Y.; Stegen, Z.; Balicas, L.; Boebinger, G. S.; Balakirev, F. F.; Migliori, Albert; Chen, H.; Liu, R. H.; Chen, X. H.								Magnetic-field-induced log-T insulating behavior in the resistivity of fluorine-doped SmFeAsO1-xFx								PHYSICAL REVIEW B				79	21					212510	10.1103/PhysRevB.79.212510			JUN 2009	2009										15							WOS:000267699200029		
J	Freire, Hermann; Correa, Eberth; Ferraz, Alvaro								Breakdown of the Fermi-liquid regime in the two-dimensional Hubbard model from a two-loop field-theoretical renormalization group approach								PHYSICAL REVIEW B				78	12					125114	10.1103/PhysRevB.78.125114			SEP 2008	2008										15							WOS:000259691500031		
J	Lee, Wei-Cheng; Sinova, Jairo; Burkov, A. A.; Joglekar, Yogesh; MacDonald, A. H.								Theory of reduced superfluid density in underdoped cuprate superconductors								PHYSICAL REVIEW B				77	21					214518	10.1103/PhysRevB.77.214518			JUN 2008	2008										15							WOS:000257288900103		
J	Cuk, T.; Struzhkin, V. V.; Devereaux, T. P.; Goncharov, A. F.; Kendziora, C. A.; Eisaki, H.; Mao, H. -K.; Shen, Z. -X.								Uncovering a pressure-tuned electronic transition in Bi(1.98)Sr(2.06)Y(0.68)Cu(2)O(8+delta) using Raman scattering and x-ray diffraction								PHYSICAL REVIEW LETTERS				100	21					217003	10.1103/PhysRevLett.100.217003			MAY 30 2008	2008										15							WOS:000256585500042		
J	Jin, K.; Zhu, B. Y.; Wu, B. X.; Vanacken, J.; Moshchalkov, V. V.; Xu, B.; Cao, L. X.; Qiu, X. G.; Zhao, B. R.								Normal-state transport in electron-doped La(2-x)Ce(x)CuO(4) thin films in magnetic fields up to 40 Tesla								PHYSICAL REVIEW B				77	17					172503	10.1103/PhysRevB.77.172503			MAY 2008	2008										15							WOS:000256763800026		
J	Liu, Defa; Li, Cong; Huang, Jianwei; Lei, Bin; Wang, Le; Wu, Xianxin; Shen, Bing; Gao, Qiang; Zhang, Yuxiao; Liu, Xu; Hu, Yong; Xu, Yu; Liang, Aiji; Liu, Jing; Ai, Ping; Zhao, Lin; He, Shaolong; Yu, Li; Liu, Guodong; Mao, Yiyuan; Dong, Xiaoli; Jia, Xiaowen; Zhang, Fengfeng; Zhang, Shenjin; Yang, Feng; Wang, Zhimin; Peng, Qinjun; Shi, Youguo; Hu, Jiangping; Xiang, Tao; Chen, Xianhui; Xu, Zuyan; Chen, Chuangtian; Zhou, X. J.								Orbital Origin of Extremely Anisotropic Superconducting Gap in Nematic Phase of FeSe Superconductor								PHYSICAL REVIEW X				8	3					031033	10.1103/PhysRevX.8.031033			AUG 2 2018	2018										14							WOS:000440635100001		
J	Wu, Wei; Scheurer, Mathias S.; Chatterjee, Shubhayu; Sachdev, Subir; Georges, Antoine; Ferrero, Michel								Pseudogap and Fermi-Surface Topology in the Two-Dimensional Hubbard Model								PHYSICAL REVIEW X				8	2					021048	10.1103/PhysRevX.8.021048			MAY 22 2018	2018										14							WOS:000433038900001		
J	Lin, Xiao; Rischau, Carl Willem; Buchauer, Lisa; Jaoui, Alexandre; Fauque, Benoit; Behnia, Kamran								Metallicity without quasi-particles in room-temperature strontium titanate								NPJ QUANTUM MATERIALS				2						41	10.1038/s41535-017-0044-5			JUL 21 2017	2017										14							WOS:000407434300001		
J	Montiel, X.; Kloss, T.; Pepin, C.								Effective SU(2) theory for the pseudogap state								PHYSICAL REVIEW B				95	10					104510	10.1103/PhysRevB.95.104510			MAR 13 2017	2017										14							WOS:000396003200006		
J	Wilcox, Bethany R.; Lewandowski, H. J.								Developing skills versus reinforcing concepts in physics labs: Insight from a survey of students' beliefs about experimental physics								PHYSICAL REVIEW PHYSICS EDUCATION RESEARCH				13	1					UNSP 010108	10.1103/PhysRevPhysEducRes.13.010108			FEB 15 2017	2017										14							WOS:000393946000001		
J	Wang, Le; Chang, Lei; Yin, Xinmao; You, Lu; Zhao, Jia-Li; Guo, Haizhong; Jin, Kuijuan; Ibrahim, Kurash; Wang, Jiaou; Rusydi, Andrivo; Wang, Junling								Self-powered sensitive and stable UV-visible photodetector based on GdNiO3/Nb-doped SrTiO3 heterojunctions								APPLIED PHYSICS LETTERS				110	4					043504	10.1063/1.4974144			JAN 23 2017	2017										14							WOS:000392837300047		
J	Kanasz-Nagy, M.; Shi, Y.; Klich, I.; Demler, E. A.								Resonant inelastic x-ray scattering as a probe of band structure effects in cuprates								PHYSICAL REVIEW B				94	16					165127	10.1103/PhysRevB.94.165127			OCT 13 2016	2016										14							WOS:000385627800003		
J	Chen, X. M.; Thampy, V.; Mazzoli, C.; Barbour, A. M.; Miao, H.; Gu, G. D.; Cao, Y.; Tranquada, J. M.; Dean, M. P. M.; Wilkins, S. B.								Remarkable Stability of Charge Density Wave Order in La1.875Ba0.125CuO4								PHYSICAL REVIEW LETTERS				117	16					167001	10.1103/PhysRevLett.117.167001			OCT 11 2016	2016										14							WOS:000385641300014		
J	Sachdev, Subir; Berg, Erez; Chatterjee, Shubhayu; Schattner, Yoni								Spin density wave order, topological order, and Fermi surface reconstruction								PHYSICAL REVIEW B				94	11					115147	10.1103/PhysRevB.94.115147			SEP 21 2016	2016										14							WOS:000383863200006		
J	Zhang, Junjie; Chen, Yu-Sheng; Phelan, D.; Zheng, Hong; Norman, M. R.; Mitchell, J. F.								Stacked charge stripes in the quasi-2D trilayer nickelate La4Ni3O8								PROCEEDINGS OF THE NATIONAL ACADEMY OF SCIENCES OF THE UNITED STATES OF AMERICA				113	32			8945	8950		10.1073/pnas.1606637113			AUG 9 2016	2016										14							WOS:000381293300043		
J	Frano, A.; Blanco-Canosa, S.; Schierle, E.; Lu, Y.; Wu, M.; Bluschke, M.; Minola, M.; Christiani, G.; Habermeier, H. U.; Logvenov, G.; Wang, Y.; van Aken, P. A.; Benckiser, E.; Weschke, E.; Le Tacon, M.; Keimer, B.								Long-range charge-density-wave proximity effect at cuprate/manganate interfaces								NATURE MATERIALS				15	8			831	+		10.1038/NMAT4682			AUG 2016	2016										14							WOS:000380849200013		
J	Ado, I. A.; Dmitriev, I. A.; Ostrovsky, P. M.; Titov, M.								Anomalous Hall Effect in a 2D Rashba Ferromagnet								PHYSICAL REVIEW LETTERS				117	4					046601	10.1103/PhysRevLett.117.046601			JUL 20 2016	2016										14							WOS:000380122800007		
