PT	AU	BA	CA	GP	RI	OI	BE	Z2	TI	X1	Y1	Z1	FT	PN	AE	Z3	SO	S1	SE	BS	VL	IS	SI	MA	BP	EP	AR	DI	D2	SU	PD	PY	AB	X4	Y4	Z4	AK	CT	CY	SP	CL	TC	Z8	ZB	ZS	Z9	SN	BN	UT	PM
J	Macke, S.; Hamann-Borrero, J. E.; Green, R. J.; Keimer, B.; Sawatzky, G. A.; Haverkort, M. W.								Dynamical Effects in Resonant X-Ray Diffraction								PHYSICAL REVIEW LETTERS				117	11					115501	10.1103/PhysRevLett.117.115501			SEP 7 2016	2016										5							WOS:000383247500010		
J	Shang, Tong-Tong; Liu, Xin-Yu; Gu, Lin								Interface of transition metal oxides at the atomic scale								SCIENCE CHINA-PHYSICS MECHANICS & ASTRONOMY				59	9					697001	10.1007/s11433-016-0122-x			SEP 2016	2016										5							WOS:000381089500010		
J	Li, Wan-Ju; Lin, Cheng-Ju; Lee, Ting-Kuo								Signatures of strong correlation effects in resonant inelastic x-ray scattering studies on cuprates								PHYSICAL REVIEW B				94	7					075127	10.1103/PhysRevB.94.075127			AUG 12 2016	2016										5							WOS:000381309600003		
J	Najafi, M. N.; Tavana, A.								Universality class of the structural phase transition in the normal phase of cuprate superconductors								PHYSICAL REVIEW E				94	2					022110	10.1103/PhysRevE.94.022110			AUG 8 2016	2016										5							WOS:000381416300005		
J	Sen, Smritijit; Ghosh, Haranath								Nematicity, magnetic fluctuation and ferro-spin-orbital ordering in BaFe2As2 family								JOURNAL OF ALLOYS AND COMPOUNDS				675				416	422		10.1016/j.jallcom.2016.03.034			AUG 5 2016	2016										5							WOS:000373614400057		
J	Wang, Jing-Rong; Liu, Guo-Zhu; Zhang, Chang-Jin								Unconventional non-Fermi liquid state caused by nematic criticality in cuprates								NEW JOURNAL OF PHYSICS				18						073023	10.1088/1367-2630/18/7/073023			JUL 12 2016	2016										5							WOS:000381870800001		
J	Yin, Xinmao; Zeng, Shengwei; Das, Tanmoy; Baskaran, G.; Asmara, Teguh Citra; Santoso, Iman; Yu, Xiaojiang; Diao, Caozheng; Yang, Ping; Breese, Mark B. H.; Venkatesan, T.; Lin, Hsin; Ariando; Rusydi, Andrivo								Coexistence of Midgap Antiferromagnetic and Mott States in Undoped, Hole- and Electron-Doped Ambipolar Cuprates								PHYSICAL REVIEW LETTERS				116	19					197002	10.1103/PhysRevLett.116.197002			MAY 12 2016	2016										5							WOS:000376014200007		
J	Atkinson, W. A.; Kampf, A. P.; Bulut, S.								Emergence of charge order in a staggered loop-current phase of cuprate high-temperature superconductors								PHYSICAL REVIEW B				93	13					134517	10.1103/PhysRevB.93.134517			APR 28 2016	2016										5							WOS:000374941100001		
J	Le Bolloc'h, D.; Sinchenko, A. A.; Jacques, V. L. R.; Ortega, L.; Lorenzo, J. E.; Chahine, G. A.; Lejay, P.; Monceau, P.								Effect of dimensionality on sliding charge density waves: The quasi-two-dimensional TbTe3 system probed by coherent x-ray diffraction								PHYSICAL REVIEW B				93	16					165124	10.1103/PhysRevB.93.165124			APR 18 2016	2016										5							WOS:000374536500006		
J	Moskvin, A. S.								Local Intra-Unit-Cell Order Parameters in Cuprates Beyond Zhang-Rice Model								JOURNAL OF SUPERCONDUCTIVITY AND NOVEL MAGNETISM				29	4			1057	1062		10.1007/s10948-016-3376-7			APR 2016	2016						5th International Conference on Fundamental Problems of High Temperature Superconductivity (FPS)	2015		Lebedev Phys Inst, Moscow, RUSSIA	5							WOS:000372542300027		
J	de Carvalho, Vanuildo S.; Pepin, Catherine; Freire, Hermann								Coexistence of Theta(II)-loop-current order with checkerboard d-wave CDW/PDW order in a hot-spot model for cuprate superconductors								PHYSICAL REVIEW B				93	11					115144	10.1103/PhysRevB.93.115144			MAR 29 2016	2016										5							WOS:000373103800002		
J	McDowell, Jenny; Styles, Kim; Sewell, Keith; Trinder, Peta; Marriott, Jennifer; Maher, Sheryl; Naidu, Som								A Simulated Learning Environment for Teaching Medicine Dispensing Skills								AMERICAN JOURNAL OF PHARMACEUTICAL EDUCATION				80	1					11	10.5688/ajpe80111			FEB 2016	2016										5							WOS:000371439300011		
J	Nafradi, B.; Keller, T.; Hardy, F.; Meingast, C.; Erb, A.; Keimer, B.								Magnetostriction and Magnetostructural Domains in Antiferromagnetic YBa2Cu3O6								PHYSICAL REVIEW LETTERS				116	4					047001	10.1103/PhysRevLett.116.047001			JAN 27 2016	2016										5							WOS:000369337800011		
J	Aragon, L. E.; Kolton, A. B.; Le Doussal, P.; Wiese, K. J.; Jagla, E. A.								Avalanches in tip-driven interfaces in random media								EPL				113	1					10002	10.1209/0295-5075/113/10002			JAN 2016	2016										5							WOS:000371479500002		
J	Harrison, N.; Sebastian, S. E.								Magnetotransport signatures of a single nodal electron pocket constructed from Fermi arcs								PHYSICAL REVIEW B				92	22					224505	10.1103/PhysRevB.92.224505			DEC 7 2015	2015										5							WOS:000366084500008		
J	Huang, S. W.; Wray, L. Andrew; Jeng, Horng-Tay; Tra, V. T.; Lee, J. M.; Langner, M. C.; Chen, J. M.; Roy, S.; Chu, Y. H.; Schoenlein, R. W.; Chuang, Y. -D.; Lin, J. -Y.								Selective interlayer ferromagnetic coupling between the Cu spins in YBa2Cu3O7-x grown on top of La0.7Ca0.3MnO3								SCIENTIFIC REPORTS				5						16690	10.1038/srep16690			NOV 17 2015	2015										5							WOS:000364753200001		
J	Lewin, Sylvia K.; Analytis, James G.								Angle-dependent magnetoresistance oscillations of cuprate superconductors in a model with Fermi surface reconstruction and magnetic breakdown								PHYSICAL REVIEW B				92	19					195130	10.1103/PhysRevB.92.195130			NOV 17 2015	2015										5							WOS:000364815100001		
J	Okazaki, Akira; Wakaura, Hikaru; Koizumi, Hiroyasu; Abou Ghantous, Michel; Tachiki, Masashi								Superconducting Transition Temperature of the Hole-Doped Cuprate as the Stabilization Temperature of Supercurrent Loops Generated by Spin-Twisting Itinerant Motion of Electrons								JOURNAL OF SUPERCONDUCTIVITY AND NOVEL MAGNETISM				28	11			3221	3233		10.1007/s10948-015-3176-5			NOV 2015	2015										5							WOS:000362585600007		
J	Sacks, William; Mauger, Alain; Noat, Yves								Pair-pair interactions as a mechanism for high-T-c superconductivity								SUPERCONDUCTOR SCIENCE & TECHNOLOGY				28	10					105014	10.1088/0953-2048/28/10/105014			OCT 2015	2015										5							WOS:000366190900021		
J	Wang, Jing								Two-loop disorder effects on the nematic quantum criticality in d-wave superconductors								PHYSICS LETTERS A				379	34-35			1917	1928		10.1016/j.physleta.2015.05.028			SEP 18 2015	2015										5							WOS:000356117900014		
J	Gabovich, Alexander M.; Li, Mai Suan; Szymczak, Henryk; Voitenko, Alexander I.								Quasiparticle current along the c axis in junctions involving d-wave superconductors partially gapped by charge density waves								PHYSICAL REVIEW B				92	5					054512	10.1103/PhysRevB.92.054512			AUG 24 2015	2015										5							WOS:000362210600008		
J	Kenfaui, Driss; Sibeud, Pierre-Frederic; Gomina, Moussa; Louradour, Eric; Chaud, Xavier; Noudem, Jacques G.								Fostered Thermomagnetic Stabilities and Boosted Mechanical Reliability Related to High Trapped Field in Composite Bulk YBa2Cu3O7-delta Cryomagnets								JOURNAL OF PHYSICAL CHEMISTRY LETTERS				6	15			2999	3005		10.1021/acs.jpclett.5b00906			AUG 6 2015	2015										5							WOS:000359333100026		
J	Wagman, J. J.; Parshall, D.; Stone, M. B.; Savici, A. T.; Zhao, Y.; Dabkowska, H. A.; Gaulin, B. D.								Quasi-two-dimensional spin and phonon excitations in La1.965Ba0.035CuO4								PHYSICAL REVIEW B				91	22					224404	10.1103/PhysRevB.91.224404			JUN 3 2015	2015										5							WOS:000355565400003		
J	Varma, Chandra M.; Zhu, Lijun								Specific heat and sound velocity at the relevant competing phase of high-temperature superconductors								PROCEEDINGS OF THE NATIONAL ACADEMY OF SCIENCES OF THE UNITED STATES OF AMERICA				112	20			6331	6335		10.1073/pnas.1417150112			MAY 19 2015	2015										5							WOS:000354729500046		
J	Krockenberger, Yoshiharu; Horio, Masafumi; Irie, Hiroshi; Fujimori, Atsushi; Yamamoto, Hideki								As-grown superconducting Pr2CuO4 under thermodynamic constraints								APPLIED PHYSICS EXPRESS				8	5					053101	10.7567/APEX.8.053101			MAY 2015	2015										5							WOS:000354963000020		
J	Durst, Adam C.								Low-temperature thermal transport at the interface of a topological insulator and a d-wave superconductor								PHYSICAL REVIEW B				91	9					094519	10.1103/PhysRevB.91.094519			MAR 31 2015	2015										5							WOS:000352059700004		
J	Samal, Debakanta; Koster, Gertjan								Manipulating oxygen sublattice in ultrathin cuprates: A new direction to engineer oxides								JOURNAL OF MATERIALS RESEARCH				30	4			463	476		10.1557/jmr.2014.391			FEB 28 2015	2015										5							WOS:000350633500002		
J	Gor'kov, Lev P.; Teitel'baum, Gregory B.								Two-component energy spectrum of cuprates in the pseudogap phase and its evolution with temperature and at charge ordering								SCIENTIFIC REPORTS				5						8524	10.1038/srep08524			FEB 17 2015	2015										5							WOS:000349456600014		
J	Vargas-Paredes, Alfredo A.; Cariglia, Marco; Doria, Mauro M.								Is the pseudogap a topological state?								JOURNAL OF MAGNETISM AND MAGNETIC MATERIALS				376				40	50		10.1016/j.jmmm.2014.09.042			FEB 15 2015	2015										5							WOS:000344950300007		
J	Efetov, K. B.								Quantum criticality in two dimensions and marginal Fermi liquid								PHYSICAL REVIEW B				91	4					045110	10.1103/PhysRevB.91.045110			JAN 12 2015	2015										5							WOS:000348762200005		
J	Iskin, M.								Stripe-ordered superfluid and supersolid phases in the attractive Hofstadter-Hubbard model								PHYSICAL REVIEW A				91	1					011601	10.1103/PhysRevA.91.011601			JAN 12 2015	2015										5							WOS:000348760000002		
J	Wachtel, Gideon; Orgad, Dror								Signatures of thermally excited vortices in a superconductor with competing orders								PHYSICAL REVIEW B				91	1					014503	10.1103/PhysRevB.91.014503			JAN 8 2015	2015										5							WOS:000349125800003		
J	Chang, K.; Deng, P.; Zhang, T.; Lin, H. -C.; Zhao, K.; Ji, S. -H.; Wang, L. -L.; He, K.; Ma, X. -C.; Chen, X.; Xue, Q. -K.								Molecular beam epitaxy growth of superconducting LiFeAs film on SrTiO3(001) substrate								EPL				109	2					28003	10.1209/0295-5075/109/28003			JAN 2015	2015										5							WOS:000349555100032		
J	Mamedov, T. A.; de Llano, M.								Are preformed Cooper pairs the cause for the pseudogap in superconductors?								PHILOSOPHICAL MAGAZINE				94	35			4102	4114		10.1080/14786435.2014.979903			DEC 12 2014	2014										5							WOS:000345505600007		
J	de Mello, E. V. L.; Sonier, J. E.								Charge segregation model for superconducting correlations in cuprates above T-c								JOURNAL OF PHYSICS-CONDENSED MATTER				26	49					492201	10.1088/0953-8984/26/49/492201			DEC 10 2014	2014										5							WOS:000345461200001		
J	Bejas, Matias; Greco, Andres; Yamase, Hiroyuki								Strong particle-hole asymmetry of charge instabilities in doped Mott insulators								NEW JOURNAL OF PHYSICS				16						123002	10.1088/1367-2630/16/12/123002			DEC 2 2014	2014										5							WOS:000346821400002		
J	Doria, Mauro M.; Vargas-Paredes, Alfredo A.; Cariglia, Marco								Coexistence of magnetic and charge order in a two-component order parameter description of the layered superconductors								SUPERCONDUCTOR SCIENCE & TECHNOLOGY				27	12					124008	10.1088/0953-2048/27/12/124008			DEC 2014	2014										5							WOS:000346196900012		
J	Chandra, Premala; Coleman, Piers; Flint, Rebecca								Ising quasiparticles and hidden order in URu2Si2								PHILOSOPHICAL MAGAZINE				94	32-33			3803	3819		10.1080/14786435.2014.937786			NOV 22 2014	2014										5							WOS:000345384200014		
J	Wachtel, Gideon; Orgad, Dror								Role of the core energy in the vortex Nernst effect								PHYSICAL REVIEW B				90	18					184505	10.1103/PhysRevB.90.184505			NOV 11 2014	2014										5							WOS:000345465300005		
J	Chern, Chyh-Hong								Pseudogap formation and quantum phase transition in strongly-correlated electron systems								ANNALS OF PHYSICS				350				159	165		10.1016/j.aop.2014.07.003			NOV 2014	2014										5							WOS:000345193100013		
J	Eremin, M. V.; Malakhov, M. A.								Dynamic charge susceptibility and softening of longitudinal phonon modes in cuprates								JETP LETTERS				100	5			324	327		10.1134/S0021364014170032			NOV 2014	2014										5							WOS:000345080400007		
J	Whitsitt, Seth; Sachdev, Subir								Renormalization group analysis of a fermionic hot-spot model								PHYSICAL REVIEW B				90	10					104505	10.1103/PhysRevB.90.104505			SEP 10 2014	2014										5							WOS:000342104800003		
J	Bakrim, H.; Bourbonnais, C.								Role of electron-phonon interaction in a magnetically driven mechanism for superconductivity								PHYSICAL REVIEW B				90	12					125119	10.1103/PhysRevB.90.125119			SEP 9 2014	2014										5							WOS:000342433300004		
J	Zhang, G. -Y.; Zhang, H.; Tan, S. -L.; Zhang, P. -X.; Tseng, T. -Y.; Habermeier, H. -U.; Lin, C. -T.; Singjai, P.								A novel strongly correlated electronic thin-film laser energy/power meter based on anisotropic Seebeck effect								APPLIED PHYSICS A-MATERIALS SCIENCE & PROCESSING				116	3			1033	1039		10.1007/s00339-014-8335-1			SEP 2014	2014										5							WOS:000340583500023		
J	Ma, Yao; Ye, Peng; Weng, Zheng-Yu								Low-temperature pseudogap phenomenon: precursor of high-T-c superconductivity								NEW JOURNAL OF PHYSICS				16						083039	10.1088/1367-2630/16/8/083039			AUG 26 2014	2014										5							WOS:000341922600001		
J	Cooper, Valentino R.; Seo, Sung S. Ambrose; Lee, Suyoun; Kim, Jun Sung; Choi, Woo Seok; Okamoto, Satoshi; Lee, Ho Nyung								Transparent conducting oxides: A delta-doped superlattice approach								SCIENTIFIC REPORTS				4						6021	10.1038/srep06021			AUG 11 2014	2014										5							WOS:000340605200002		
J	Springell, R.; Ward, R. C. C.; Bouchet, J.; Chivall, J.; Wermeille, D.; Normile, P. S.; Langridge, S.; Zochowski, S. W.; Lander, G. H.								Malleability of uranium: Manipulating the charge-density wave in epitaxial films								PHYSICAL REVIEW B				89	24					245101	10.1103/PhysRevB.89.245101			JUN 2 2014	2014										5							WOS:000337275000001		
J	Kuntscher, C. A.; Huber, A.; Huecker, M.								Suppression of the charge-density-wave state in Sr10Ca4Cu24O41 by external pressure								PHYSICAL REVIEW B				89	13					134510	10.1103/PhysRevB.89.134510			APR 17 2014	2014										5							WOS:000334593700004		
J	Zheng, Xiao-Jun; Huang, Zhong-Bing; Zou, Liang-Jian								Spontaneous Fermi Surface Deformation in the Three-Band Hubbard Model: A Variational Monte Carlo Study								JOURNAL OF THE PHYSICAL SOCIETY OF JAPAN				83	2					024705	10.7566/JPSJ.83.024705			FEB 2014	2014										5							WOS:000331226300028		
J	Lee, Hunpyo; Zhang, Yu-Zhong; Jeschke, Harald O.; Valenti, Roser								Competition between band and Mott insulators in the bilayer Hubbard model: A dynamical cluster approximation study								PHYSICAL REVIEW B				89	3					035139	10.1103/PhysRevB.89.035139			JAN 23 2014	2014										5							WOS:000332232300003		
J	Schlegel, R.; Haenke, T.; Baumann, D.; Kaiser, M.; Nag, P. K.; Voigtlaender, R.; Lindackers, D.; Buechner, B.; Hess, C.								Design and properties of a cryogenic dip-stick scanning tunneling microscope with capacitive coarse approach control								REVIEW OF SCIENTIFIC INSTRUMENTS				85	1					013706	10.1063/1.4862817			JAN 2014	2014										5							WOS:000331217300037		
J	Chen, Y-J; Lin, P. J.; Wu, K. H.; Rosenstein, B.; Luo, C. W.; Juang, J. Y.; Lin, J-Y								Superconducting fluctuations and the Nernst effect in high-T-c superconductors								SUPERCONDUCTOR SCIENCE & TECHNOLOGY				26	10					105029	10.1088/0953-2048/26/10/105029			OCT 2013	2013										5							WOS:000324431000031		
J	He, Yan; Scherpelz, Peter; Levin, K.								Theory of fluctuating charge ordering in the pseudogap phase of cuprates via a preformed pair approach								PHYSICAL REVIEW B				88	6					064516	10.1103/PhysRevB.88.064516			AUG 30 2013	2013										5							WOS:000327535100004		
J	Gastiasoro, Maria N.; Andersen, Brian M.								Impurity Bound States and Disorder-Induced Orbital and Magnetic Order in the s(+/-) State of Fe-Based Superconductors								JOURNAL OF SUPERCONDUCTIVITY AND NOVEL MAGNETISM				26	8			2651	2655		10.1007/s10948-013-2153			AUG 2013	2013										5							WOS:000323925500017		
J	Schmid, Markus; Loder, Florian; Kampf, Arno P.; Kopp, Thilo								Disorder induced stripes in d-wave superconductors								NEW JOURNAL OF PHYSICS				15						073049	10.1088/1367-2630/15/7/073049			JUL 26 2013	2013										5							WOS:000322310700002		
J	Matusiak, M.; Lipatov, A.; Gribanov, A.; Kaczorowski, D.								Anomalous Nernst effect in the ferromagnetic Kondo lattice Ce3RhSi3								JOURNAL OF PHYSICS-CONDENSED MATTER				25	26					265601	10.1088/0953-8984/25/26/265601			JUL 3 2013	2013										5							WOS:000320329400009		
J	Yamase, Hiroyuki								Mean-field theory on a coupled system of ferromagnetism and electronic nematic order								PHYSICAL REVIEW B				87	19					195117	10.1103/PhysRevB.87.195117			MAY 13 2013	2013										5							WOS:000319056200003		
J	Stingl, C.; Perry, R. S.; Maeno, Y.; Gegenwart, P.								Electronic nematicity and its relation to quantum criticality in Sr3Ru2O7 studied by thermal expansion								PHYSICA STATUS SOLIDI B-BASIC SOLID STATE PHYSICS				250	3			450	456		10.1002/pssb.201200905			MAR 2013	2013										5							WOS:000316290200004		
J	Tanaka, Y.; Yanagisawa, T.; Nishio, T.								Unlocking interband phase difference in multiband superconductors								PHYSICA C-SUPERCONDUCTIVITY AND ITS APPLICATIONS				485				64	70		10.1016/j.physc.2012.10.004			FEB 2013	2013										5							WOS:000316932700012		
J	Peng, Lin; Liu, Yong-sheng; Chen, Chang-Zhao; Li, Hui-yu; Jia, Cai-li; Zou, Qian-lin								Variation of Vortex Charges in Hole Over-Doped High-Temperature Superconductors with Competing Anti-Ferromagnetic and d-Wave Superconducting Order								JOURNAL OF LOW TEMPERATURE PHYSICS				170	1-2			91	98		10.1007/s10909-012-0714-4			JAN 2013	2013										5							WOS:000312490100007		
J	Kwang-Hua, Chu W.								Effect of defects on the pressure-induced transitional electronic transport in TbTe3 and ZrTe3								CHEMICAL PHYSICS				409				37	40		10.1016/j.chemphys.2012.09.025			DEC 10 2012	2012										5							WOS:000311636500005		
J	Chung, Sangwoo S.; Kakashvili, Paata; Bolech, C. J.								Numerical simulation of the Nernst effect in extreme type-II superconductors: A negative Nernst signal and its noise power spectra								PHYSICAL REVIEW B				86	13					134525	10.1103/PhysRevB.86.134525			OCT 22 2012	2012										5							WOS:000310129000009		
J	Holt, Michael; Oitmaa, Jaan; Chen, Wei; Sushkov, Oleg P.								Fermi Surface Reconstruction by Dynamic Magnetic Fluctuations								PHYSICAL REVIEW LETTERS				109	3					037001	10.1103/PhysRevLett.109.037001			JUL 17 2012	2012										5							WOS:000306466900018		
J	Sugai, S.; Tamai, Y.; Takayanagi, Y.; Hayamizu, N.; Muroi, T.								Direct Observation of k parallel to and k perpendicular to Stripe Excitations in La2-xSrxCuO4								JOURNAL OF SUPERCONDUCTIVITY AND NOVEL MAGNETISM				25	5			1393	1397		10.1007/s10948-012-1528-y			JUL 2012	2012										5							WOS:000305523100035		
J	Kokanovic, I.; Cooper, J. R.; Iida, Kazumasa								Changes in the in- and out-of-plane magnetic susceptibility of YBCO crystals with temperature and hole content								EPL				98	5					57011	10.1209/0295-5075/98/57011			JUN 2012	2012										5							WOS:000305276600035		
J	Smadici, S.; Lee, J. C. T.; Rusydi, A.; Logvenov, G.; Bozovic, I.; Abbamonte, P.								Distinct oxygen hole doping in different layers of Sr2CuO4-delta/La2CuO4 superlattices								PHYSICAL REVIEW B				85	9					094519	10.1103/PhysRevB.85.094519			MAR 28 2012	2012										5							WOS:000302003400003		
J	Pinheiro, C. F. S.; de Mello, E. V. L.								Random resistivity network calculations for cuprate superconductors with an electronic phase separation transition								PHYSICA A-STATISTICAL MECHANICS AND ITS APPLICATIONS				391	4			1532	1539		10.1016/j.physa.2011.08.033			FEB 15 2012	2012										5							WOS:000300459700059		
J	Andersen, B. M.; Graser, S.; Hirschfeld, P. J.								Correlation and disorder-enhanced nematic spin response in superconductors with weakly broken rotational symmetry								EPL				97	4					47002	10.1209/0295-5075/97/47002			FEB 2012	2012										5							WOS:000300844100032		
J	Wolf, S. A.; Kresin, V. Z.								Ordering of Dopants and Potential Increase in T-c to Near-room Temperature								JOURNAL OF SUPERCONDUCTIVITY AND NOVEL MAGNETISM				25	2			165	167		10.1007/s10948-011-1363-6			FEB 2012	2012										5							WOS:000300786300005		
J	Yildirim, Yucel; Ku, Wei								Kinetics-Driven Superconducting Gap in Underdoped Cuprate Superconductors Within the Strong-Coupling Limit								PHYSICAL REVIEW X				1	1					011011	10.1103/PhysRevX.1.011011			SEP 15 2011	2011										5							WOS:000310505600007		
J	Harshman, Dale R.; Fiory, Anthony T.								Concerning the superconducting gap symmetry in YBa2Cu3O7-delta, YBa2Cu4O8, and La2-xSrxCuO4 determined from muon spin rotation in mixed states of crystals and powders								JOURNAL OF PHYSICS-CONDENSED MATTER				23	31					315702	10.1088/0953-8984/23/31/315702			AUG 10 2011	2011										5							WOS:000293008900012		
J	Audouard, Alain; Duc, Fabienne; Vignolles, David; Lyubovskii, Rustem B.; Vendier, Laure; Shilov, Gena V.; Zhilyaeva, Elena I.; Lyubovskaya, Rimma N.; Canadell, Enric								Temperature- and pressure-dependent metallic states in (BEDT-TTF)(8)[Hg4Br12(C6H5Br)(2)]								PHYSICAL REVIEW B				84	4					045101	10.1103/PhysRevB.84.045101			JUL 5 2011	2011										5							WOS:000292385000002		
J	Belova, P.; Safonchik, M.; Traito, K. B.; Lahderanta, E.								Cutoff parameter of the field distribution in the mixed state of iron pnictides with s(+/-) and s(++) pairing symmetries								PHYSICAL REVIEW B				83	10					104518	10.1103/PhysRevB.83.104518			MAR 25 2011	2011										5							WOS:000288782700006		
J	Bejas, Matias; Buzon, Guillermo; Greco, Andres; Foussats, Adriana								Doping and temperature dependence of the pseudogap and Fermi arcs in cuprates from d-CDW with short-range fluctuations in the context of the t-J model								PHYSICAL REVIEW B				83	1					014514	10.1103/PhysRevB.83.014514			JAN 31 2011	2011										5							WOS:000286743200004		
J	Hackl, Rudi								Superconductivity in copper-oxygen compounds								ZEITSCHRIFT FUR KRISTALLOGRAPHIE-CRYSTALLINE MATERIALS				226	4			323	342		10.1524/zkri.2011.1385			2011	2011										5							WOS:000290720900004		
J	Carbone, Anna; Gilli, Marco; Mazzetti, Piero; Ponta, Linda								Array of Josephson junctions with a nonsinusoidal current-phase relation as a model of the resistive transition of unconventional superconductors								JOURNAL OF APPLIED PHYSICS				108	12					123916	10.1063/1.3525984			DEC 15 2010	2010										5							WOS:000285768800077		
J	Tanaka, Y.; Iyo, A.; Tokiwa, K.; Watanabe, T.; Crisan, A.; Sundaresan, A.; Terada, N.								Topological structure of the inter-band phase difference soliton in two-band superconductivity								PHYSICA C-SUPERCONDUCTIVITY AND ITS APPLICATIONS				470	20			1010	1012		10.1016/j.physc.2010.05.022			NOV 1 2010	2010						22nd International Symposium on Superconductivity (ISS 2009)	NOV 02-04, 2009	Int Superconductiv Technol Ctr	Tsukuba, JAPAN	5							WOS:000282241800012		
J	Hackl, Andreas; Vojta, Matthias								Stripe order and quasiparticle Nernst effect in cuprate superconductors								NEW JOURNAL OF PHYSICS				12						105011	10.1088/1367-2630/12/10/105011			OCT 29 2010	2010										5							WOS:000284770500007		
J	Zhang, Wei; Palmeri, Patrick; Quinet, Pascal; Biemont, Emile; Du, Shan; Dai, Zhenwen								Radiative-lifetime measurements and calculations of odd-parity highly excited levels in Ba I								PHYSICAL REVIEW A				82	4					042507	10.1103/PhysRevA.82.042507			OCT 14 2010	2010										5							WOS:000282936800003		
J	Eder, R.; Wrobel, P.; Ohta, Y.								Theory of the lightly doped Mott insulator								PHYSICAL REVIEW B				82	15					155109	10.1103/PhysRevB.82.155109			OCT 6 2010	2010										5							WOS:000282568700006		
J	Wang, Zhi; Liu, Bin; Feng, Shiping								Extinction of quasiparticle scattering interference in cuprate superconductors								PHYSICS LETTERS A				374	30			3084	3091		10.1016/j.physleta.2010.05.042			JUL 5 2010	2010										5							WOS:000280452400016		
J	Sonier, J. E.								High-field mu SR studies of superconducting and magnetic correlations in cuprates above T-c								JOURNAL OF PHYSICS-CONDENSED MATTER				22	20					203202	10.1088/0953-8984/22/20/203202			MAY 26 2010	2010										5							WOS:000277215500003		
J	Kim, Eun-Ah; Lawler, Michael J.								Interference of nematic quantum critical quasiparticles: A route to the octet model								PHYSICAL REVIEW B				81	13					132501	10.1103/PhysRevB.81.132501			APR 1 2010	2010										5							WOS:000277207900014		
J	Kabanov, V. V.; Alexandrov, A. S.								Magnetic quantum oscillations in doped antiferromagnetic insulators (vol 77, 132403, 2008)								PHYSICAL REVIEW B				81	9					099907	10.1103/PhysRevB.81.099907			MAR 1 2010	2010										5							WOS:000276207300124		
J	Mishchenko, A. S.								Manifestations of the Electron-Phonon Coupling in the Spectroscopy of High-Temperature Superconductors								ADVANCES IN CONDENSED MATTER PHYSICS										306106	10.1155/2010/306106			2010	2010										5							WOS:000294020500001		
J	Guidry, Mike; Sun, Yang; Wu, Cheng-Li								Strong anisotropy of cuprate pseudogap correlations: implications for Fermi arcs and Fermi pockets								NEW JOURNAL OF PHYSICS				11						123023	10.1088/1367-2630/11/12/123023			DEC 21 2009	2009										5							WOS:000273086200003		
