PT	AU	BA	CA	GP	RI	OI	BE	Z2	TI	X1	Y1	Z1	FT	PN	AE	Z3	SO	S1	SE	BS	VL	IS	SI	MA	BP	EP	AR	DI	D2	SU	PD	PY	AB	X4	Y4	Z4	AK	CT	CY	SP	CL	TC	Z8	ZB	ZS	Z9	SN	BN	UT	PM
J	Yin, X.; Zhang, C.; Mu, G.; Hu, T.; Zhang, M.; Xiao, H.								Pressure tuning of iron-based superconductor Ca-10(Pt3As8) ((Fe0.95Pt0.05)(2)As-2)(5)								JOURNAL OF PHYSICS-CONDENSED MATTER				31	14					145601	10.1088/1361-648X/aaffae			APR 10 2019	2019										1							WOS:000460784200001		
J	Rosenberg, Elliott W.; Chu, Jiun-Haw; Ruff, Jacob P. C.; Hristov, Alexander T.; Fisher, Ian R.								Divergence of the quadrupole-strain susceptibility of the electronic nematic system YbRu2Ge2								PROCEEDINGS OF THE NATIONAL ACADEMY OF SCIENCES OF THE UNITED STATES OF AMERICA				116	15			7232	7237		10.1073/pnas.1818910116			APR 9 2019	2019										1							WOS:000463936900017		
J	Boyack, Rufus; Wang, Xiaoyu; Chen, Qijin; Levin, K.								Combined effects of pairing fluctuations and a pseudogap in the cuprate Hall coefficient								PHYSICAL REVIEW B				99	13					134504	10.1103/PhysRevB.99.134504			APR 4 2019	2019										1							WOS:000463879000003		
J	Kang, Mingu; Pelliciari, Jonathan; Frano, Alex; Breznay, Nicholas; Schierle, Enrico; Weschke, Eugen; Sutarto, Ronny; He, Feizhou; Shafer, Padraic; Arenholz, Elke; Chen, Mo; Zhang, Keto; Ruiz, Alejandro; Hao, Zeyu; Lewin, Sylvia; Analytis, James; Krockenberger, Yoshiharu; Yamamoto, Hideki; Das, Tanmoy; Comin, Riccardo								Evolution of charge order topology across a magnetic phase transition in cuprate superconductors								NATURE PHYSICS				15	4			335	+		10.1038/s41567-018-0401-8			APR 2019	2019										1							WOS:000462874800017		
J	Leshen, Justin; Kavai, Mariam; Giannakis, Ioannis; Kaneko, Yoshio; Tokura, Yoshi; Mukherjee, Shantanu; Lee, Wei-Cheng; Aynajiari, Pegor								Emergent charge order near the doping-induced Mott-insulating quantum phase transition in Sr3Ru2O7								COMMUNICATIONS PHYSICS				2						36	10.1038/s42005-019-0138-4			MAR 29 2019	2019										1							WOS:000463781200001		
J	Gao, Deheng; Mou, Yingping; Liu, Yiqun; Tan, Shuning; Feng, Shiping								Autocorrelation of quasiparticle spectral intensities and its connection with quasiparticle scattering interference in cuprate superconductors								PHILOSOPHICAL MAGAZINE				99	6			752	769		10.1080/14786435.2018.1551635			MAR 19 2019	2019										1							WOS:000457970000006		
J	Seo, Y., I; Choi, W. J.; Kimura, Shin-ichi; Kwon, Yong Seung								Evidence for a preformed Cooper pair model in the pseudogap spectra of a Ca-10(Pt4As8)(Fe2As2)(5) single crystal with a nodal superconducting gap								SCIENTIFIC REPORTS				9						3987	10.1038/s41598-019-40528-3			MAR 8 2019	2019										1							WOS:000460627700075		
J	Zhang, Cheng-Long; Wang, C. M.; Yuan, Zhujun; Xu, Xitong; Wang, Guangqiang; Lee, Chi-Cheng; Pi, Li; Xi, Changying; Lin, Hsin; Harrison, Neil; Lu, Hai-Zhou; Zhang, Jinglei; Jia, Shuang								Non-saturating quantum magnetization in Weyl semimetal TaAs								NATURE COMMUNICATIONS				10						1028	10.1038/s41467-019-09012-4			MAR 4 2019	2019										1							WOS:000460125400010		
J	Greschner, Sebastian; Filippone, Michele; Giamarchi, Thierry								Universal Hall Response in Interacting Quantum Systems								PHYSICAL REVIEW LETTERS				122	8					083402	10.1103/PhysRevLett.122.083402			FEB 28 2019	2019										1							WOS:000459920900005		
J	Imada, Masatoshi; Suzuki, Takafumi J.								Excitons and Dark Fermions as Origins of Mott Gap, Pseudogap and Superconductivity in Cuprate Superconductors - General Concept and Basic Formalism Based on Gap Physics								JOURNAL OF THE PHYSICAL SOCIETY OF JAPAN				88	2					024701	10.7566/JPSJ.88.024701			FEB 15 2019	2019										1							WOS:000455726300012		
J	Chu, Z.; Chang, F. G.; Han, L.; Ma, Z. P.; Yang, F.								Photovoltaic effect in cuprate superconductor (Bi, Pb)(2)Sr2Ca2Cu3O10+delta and Bi2Sr2CaCu2O8+delta under magnetic field								CERAMICS INTERNATIONAL				45	2			2028	2035		10.1016/j.ceramint.2018.10.102			FEB 1 2019	2019										1							WOS:000453492800067		
J	Lovesey, S. W.; Chatterji, T.; Stunault, A.; Khalyavin, D. D.; van der Laan, G.								Direct Observation of Anapoles by Neutron Diffraction								PHYSICAL REVIEW LETTERS				122	4					047203	10.1103/PhysRevLett.122.047203			FEB 1 2019	2019										1							WOS:000457706700029		
J	Nourafkan, R.; Cote, M.; Tremblayl, A-M S.								Charge fluctuations in lightly hole-doped cuprates: Effect of vertex corrections								PHYSICAL REVIEW B				99	3					035161	10.1103/PhysRevB.99.035161			JAN 29 2019	2019										1							WOS:000457058500006		
J	Arumugam, S.; Krishnan, Manikandan; Ishigaki, Kent; Gouchi, Jun; Pervin, Rukshana; Selvan, G. Kalai; Shirage, Parasharam M.; Uwatoko, Y.								Enhancement of superconducting properties and flux pinning mechanism on Cr0.0005NbSe2 single crystal under Hydrostatic pressure								SCIENTIFIC REPORTS				9						347	10.1038/s41598-018-36672-x			JAN 23 2019	2019										1							WOS:000456392400028		
J	Bhatt, Jitesh R.; Das, Arpan; Mishra, Hiranmaya								Thermoelectric effect and Seebeck coefficient for hot and dense hadronic matter								PHYSICAL REVIEW D				99	1					014015	10.1103/PhysRevD.99.014015			JAN 10 2019	2019										1							WOS:000455830100005		
J	Ikeda, M. S.; Worasaran, T.; Palmstrom, J. C.; Straquadine, J. A. W.; Walmsley, P.; Fisher, I. R.								Symmetric and antisymmetric strain as continuous tuning parameters for electronic nematic order								PHYSICAL REVIEW B				98	24					245133	10.1103/PhysRevB.98.245133			DEC 21 2018	2018										1							WOS:000454155400002		
J	Ivantsov, Ilya; Ferraz, Alvaro; Kochetov, Evgenii								Fermi surface reconstruction in underdoped cuprates: Origin of electron pockets								PHYSICAL REVIEW B				98	21					214511	10.1103/PhysRevB.98.214511			DEC 17 2018	2018										1							WOS:000453458900006		
J	Fete, A.; Senatore, C.								Strong improvement of the transport characteristics of YBa2Cu3O7-x grain boundaries using ionic liquid gating								SCIENTIFIC REPORTS				8						17703	10.1038/s41598-018-36166-w			DEC 7 2018	2018										1							WOS:000452635000005		
J	Yanagisawa, Takashi; Hase, Izumi; Tanaka, Yasumoto								Massless and quantized modes of kinks in the phase space of superconducting gaps								PHYSICS LETTERS A				382	48			3483	3489		10.1016/j.physleta.2018.10.008			DEC 5 2018	2018										1							WOS:000449897300007		
J	Mazumdar, Sumit								Valence transition model of the pseudogap, charge order, and superconductivity in electron-doped and hole-doped copper oxides								PHYSICAL REVIEW B				98	20					205153	10.1103/PhysRevB.98.205153			NOV 30 2018	2018										1							WOS:000452002100002		
J	Fu, X.; Shi, Q.; Zudov, M. A.; Chung, Y. J.; Baldwin, K. W.; Pfeiffer, L. N.; West, K. W.								Quantum Hall stripes in high-density GaAs/AlGaAs quantum wells								PHYSICAL REVIEW B				98	20					205418	10.1103/PhysRevB.98.205418			NOV 26 2018	2018										1							WOS:000451333100010		
J	Mitscherling, Johannes; Metzner, Walter								Longitudinal conductivity and Hall coefficient in two-dimensional metals with spiral magnetic order								PHYSICAL REVIEW B				98	19					195126	10.1103/PhysRevB.98.195126			NOV 20 2018	2018										1							WOS:000450992000003		
J	Syromyatnikov, A., V								Collective excitations in spin-1/2 magnets through bond-operator formalism designed both for paramagnetic and ordered phases								PHYSICAL REVIEW B				98	18					184421	10.1103/PhysRevB.98.184421			NOV 19 2018	2018										1							WOS:000450547400005		
J	Biswas, Pabitra K.; Kreisel, Andreas; Wang, Qisi; Adroja, Devashibhai T.; Hillier, Adrian D.; Zhao, Jun; Khasanov, Rustem; Orain, Jean-Christophe; Amato, Alex; Morenzoni, Elvezio								Evidence of nodal gap structure in the basal plane of the FeSe superconductor								PHYSICAL REVIEW B				98	18					180501	10.1103/PhysRevB.98.180501			NOV 8 2018	2018										1							WOS:000449515500001		
J	Cogdill, Alexandria P.; Gaudreau, Pierre Olivier; Arora, Reetakshi; Gopalakrishnan, Vancheswaran; Wargo, Jennifer A.								The Impact of Intratumoral and Gastrointestinal Microbiota on Systemic Cancer Therapy								TRENDS IN IMMUNOLOGY				39	11			900	920		10.1016/j.it.2018.09.007			NOV 2018	2018										1							WOS:000449096700005		
J	Gimazov, I. I.; Adachi, T.; Omori, K.; Tanabe, Y.; Koike, Y.; Talanov, Yu. I.								Microwave Absorption by Charge Density Waves in La2-xSrxCuO4								JETP LETTERS				108	10			675	679		10.1134/S0021364018220034			NOV 2018	2018										1							WOS:000459432300006		
J	Leong, Zhidong; Limtragool, Kridsanaphong; Setty, Chandan; Phillips, Philip W.								Scale invariance as the cause of the superconducting dome in the cuprates								PHYSICAL REVIEW B				98	18					184501	10.1103/PhysRevB.98.184501			NOV 1 2018	2018										1							WOS:000448913300003		
J	Barci, Daniel G.; Fradkin, Eduardo; Ribeiro, Leonardo								Bosonization of Fermi liquids in a weak magnetic field								PHYSICAL REVIEW B				98	15					155146	10.1103/PhysRevB.98.155146			OCT 29 2018	2018										1							WOS:000448595400004		
J	Zegrodnik, Michal; Spalek, Jozef								Incorporation of charge- and pair-density-wave states into the one-band model of d-wave superconductivity								PHYSICAL REVIEW B				98	15					155144	10.1103/PhysRevB.98.155144			OCT 29 2018	2018										1							WOS:000448595400002		
J	Wang, C. G.; Li, Z.; Yang, J.; Xing, L. Y.; Dai, G. Y.; Wang, X. C.; Jin, C. Q.; Zhou, R.; Zheng, Guo-qing								Electron Mass Enhancement near a Nematic Quantum Critical Point in NaFe1-xCoxAs								PHYSICAL REVIEW LETTERS				121	16					167004	10.1103/PhysRevLett.121.167004			OCT 19 2018	2018										1							WOS:000447730600014		
J	Cao, Jin-Jin; Gou, Xiao-Fan; Wang, Tian-Ge; Jiang, Zhao-Fei								A unified model for the uniaxial and hydrostatic pressure dependence of T-c in YBa2Cu3Ox (x approximate to 6.95-7.0)								COMPUTATIONAL MATERIALS SCIENCE				153				268	274		10.1016/j.commatsci.2018.07.004			OCT 2018	2018										1							WOS:000441521600033		
J	Kwon, Ji-Hwan; Meng, Yifei; Wu, Lijun; Zhu, Yimei; Zhang, Yifei; Selvamanickam, Venkat; Welp, Ulrich; Kwok, Wai-Kwong; Zuo, Jian-Min								Extended electronic structure inhomogeneity created by double chain layer defects surrounding columnar tracks in heavy-ion irradiated YBa2Cu3O7-delta								SUPERCONDUCTOR SCIENCE & TECHNOLOGY				31	10					105006	10.1088/1361-6668/aad842			OCT 2018	2018										1							WOS:000443310600001		
J	Scheie, Allen								LongHCPulse: Long-Pulse Heat Capacity on a Quantum Design PPMS								JOURNAL OF LOW TEMPERATURE PHYSICS				193	1-2			60	73		10.1007/s10909-018-2042-9			OCT 2018	2018										1							WOS:000441302800006		
J	Zhang, Qingteng; Dufresne, Eric M.; Sandy, Alec R.								Dynamics in hard condensed matter probed by X-ray photon correlation spectroscopy: Present and beyond								CURRENT OPINION IN SOLID STATE & MATERIALS SCIENCE				22	5			202	212		10.1016/j.cossms.2018.06.002			OCT 2018	2018										1							WOS:000452575700004		
J	Banerjee, Anurag; Garg, Arti; Ghosal, Amit								Emergent superconductivity upon disordering a charge density wave ground state								PHYSICAL REVIEW B				98	10					104206	10.1103/PhysRevB.98.104206			SEP 25 2018	2018										1							WOS:000445595200002		
J	Korshunov, M. M.								Effect of gap anisotropy on the spin resonance peak in the superconducting state of iron-based materials								PHYSICAL REVIEW B				98	10					104510	10.1103/PhysRevB.98.104510			SEP 24 2018	2018										1							WOS:000445504500005		
J	Chern, Chyh-Hong								Theory of superconductivity in strongly correlated electron systems								INTERNATIONAL JOURNAL OF MODERN PHYSICS B				32	23					1850257	10.1142/S0217979218502570			SEP 20 2018	2018										1							WOS:000443149900011		
J	Ali, Khadiza; Maiti, Kalobaran								Dimensionality, nematicity and superconductivity in Fe-based systems								EUROPEAN PHYSICAL JOURNAL B				91	9					199	10.1140/epjb/e2018-90359-2			SEP 12 2018	2018										1							WOS:000444640900002		
J	Wang, Jingyue; Niu, Jingjing; Yan, Baoming; Li, Xinqi; Bi, Ran; Yao, Yuan; Yu, Dapeng; Wu, Xiaosong								Vanishing quantum oscillations in Dirac semimetal ZrTe5								PROCEEDINGS OF THE NATIONAL ACADEMY OF SCIENCES OF THE UNITED STATES OF AMERICA				115	37			9145	9150		10.1073/pnas.1804958115			SEP 11 2018	2018										1							WOS:000444257200047		
J	Yang, F.; Wu, M. W.								Gauge-invariant microscopic kinetic theory of superconductivity in response to electromagnetic fields								PHYSICAL REVIEW B				98	9					094507	10.1103/PhysRevB.98.094507			SEP 10 2018	2018										1							WOS:000444203200006		
J	Styers, Melanie L.; Van Zandt, Peter A.; Hayden, Katherine L.								Active Learning in Flipped Life Science Courses Promotes Development of Critical Thinking Skills								CBE-LIFE SCIENCES EDUCATION				17	3					ar39	10.1187/cbe.16-11-0332			SEP 1 2018	2018										1							WOS:000443850200001		
J	Tanaka, Y.; Yamamori, H.; Yanagisawa, T.; Nishio, T.; Arisawa, S.								An unconventional vortex state in a superconducting bilayer where one layer has a hole								SOLID STATE COMMUNICATIONS				277				39	44		10.1016/j.ssc.2018.04.012			SEP 2018	2018										1							WOS:000432733700007		
J	Scheerer, Gernot W.; Ren, Zhi; Watanabe, Shinji; Lapertot, Gerard; Aoki, Dai; Jaccard, Didier; Miyake, Kazumasa								The dominant role of critical valence fluctuations on high T-c superconductivity in heavy fermions								NPJ QUANTUM MATERIALS				3						41	10.1038/s41535-018-0111-6			AUG 29 2018	2018										1							WOS:000449703900001		
J	Iwasawa, Hideaki; Schroter, Niels B. M.; Masui, Takahiko; Tajima, Setsuko; Kim, Timur K.; Hoesch, Moritz								Surface termination and electronic reconstruction in YBa2Cu3O7-delta								PHYSICAL REVIEW B				98	8					081112	10.1103/PhysRevB.98.081112			AUG 21 2018	2018										1							WOS:000442342700001		
J	Seiro, S.; Jiao, L.; Kirchner, S.; Hartmann, S.; Friedemann, S.; Krellner, C.; Geibel, C.; Si, Q.; Steglich, F.; Wirth, S.								Evolution of the Kondo lattice and non-Fermi liquid excitations in a heavy-fermion metal								NATURE COMMUNICATIONS				9						3324	10.1038/s41467-018-05801-5			AUG 20 2018	2018										1							WOS:000442123200009		
J	Tanaka, Y.; Yamamori, H.; Yanagisawa, T.; Nishio, T.; Arisawa, S.								Abnormal Meissner state in a superconducting bilayer								PHYSICA C-SUPERCONDUCTIVITY AND ITS APPLICATIONS				551				41	47		10.1016/j.physc.2018.05.007			AUG 15 2018	2018										1							WOS:000437660000009		
J	Cui, Tianbai; Fernandes, Rafael M.								Smeared nematic quantum phase transitions due to rare-region effects in inhomogeneous systems								PHYSICAL REVIEW B				98	8					085117	10.1103/PhysRevB.98.085117			AUG 8 2018	2018										1							WOS:000441108600004		
J	Zhang, Zhiwei; Sutarto, R.; He, F.; Chou, F. C.; Udby, L.; Holm, S. L.; Zhu, Z. H.; Hines, W. A.; Budnick, J. I.; Wells, B. O.								Nematicity and Charge Order in Superoxygenated La2-xSrxCuO4+y								PHYSICAL REVIEW LETTERS				121	6					067602	10.1103/PhysRevLett.121.067602			AUG 8 2018	2018										1							WOS:000441112300018		
J	Kurashima, Koshi; Adachi, Tadashi; Suzuki, Kensuke M.; Fukunaga, Yasushi; Kawamata, Takayuki; Noji, Takashi; Miyasaka, Hitoshi; Watanabe, Isao; Miyazaki, Masanori; Koda, Akihiro; Kadono, Ryosuke; Koike, Yoji								Development of Ferromagnetic Fluctuations in Heavily Overdoped (Bi,Pb)(2)Sr2CuO6+delta Copper Oxides								PHYSICAL REVIEW LETTERS				121	5					057002	10.1103/PhysRevLett.121.057002			AUG 1 2018	2018										1							WOS:000440415600007		
J	Song, Yanjie								Improving primary students' collaborative problem solving competency in project-based science learning with productive failure instructional design in a seamless learning environment								ETR&D-EDUCATIONAL TECHNOLOGY RESEARCH AND DEVELOPMENT				66	4			979	1008		10.1007/s11423-018-9600-3			AUG 2018	2018										1							WOS:000438647900007		
J	Salamatin, D. A.; Sidorov, V. A.; Kichanov, S. E.; Velichkov, A.; Salamatin, A. V.; Fomicheva, L. N.; Kozlenko, D. P.; Nikolaev, A. V.; Menzel, D.; Budzynski, M.; Tsvyashchenko, A. V.								Coexistence of charge density wave and incommensurate antiferromagnetism in the cubic phase of DyGe2.85 synthesised under high pressure								JOURNAL OF ALLOYS AND COMPOUNDS				755				10	14		10.1016/j.jallcom.2018.04.319			JUL 30 2018	2018										1							WOS:000432676800002		
J	Wu, Beilun; Aoki, Dai; Brison, Jean-Pascal								Vortex liquid phase in the p-wave ferromagnetic superconductor UCoGe								PHYSICAL REVIEW B				98	2					024517	10.1103/PhysRevB.98.024517			JUL 26 2018	2018										1							WOS:000439787000005		
J	Kim, Hyun-Tak								Analysis of the diverging effective mass in YaBa(2)Cu(3)O(6+x) for high-T-c mechanism and pairing symmetry								INTERNATIONAL JOURNAL OF MODERN PHYSICS B				32	17					1840031	10.1142/S0217979218400313			JUL 10 2018	2018						International Conference on Electron Correlation in Superconductors in Nanostructures (ECSN)	AUG 17-20, 2017		Odessa, UKRAINE	1							WOS:000438217300016		
J	Khanof, Sogol; Mannhart, Jochen; Boschker, Hans								Coherently strained epitaxial YBa2Cu3O7-delta films grown on NdGaO3 (110)								APPLIED PHYSICS LETTERS				113	2					022605	10.1063/1.5037540			JUL 9 2018	2018										1							WOS:000438744300022		
J	He, Y.; Wu, S.; Song, Y.; Lee, W-S; Said, A. H.; Alatas, A.; Bosak, A.; Girard, A.; Souliou, S. M.; Ruiz, A.; Hepting, M.; Bluschke, M.; Schierle, E.; Weschke, E.; Lee, J-S; Jang, H.; Huang, H.; Hashimoto, M.; Lu, D-H; Song, D.; Yoshida, Y.; Eisaki, H.; Shen, Z-X; Birgeneau, R. J.; Yi, M.; Frano, A.								Persistent low-energy phonon broadening near the charge-order q vector in the bilayer cuprate Bi2Sr2CaCu2O8+delta								PHYSICAL REVIEW B				98	3					035102	10.1103/PhysRevB.98.035102			JUL 2 2018	2018										1							WOS:000436938600002		
J	Li, Zheng; Zheng, Guo-qing								Nuclear magnetic resonance measurement station in SECUF using hybrid superconducting magnets								CHINESE PHYSICS B				27	7					077404	10.1088/1674-1056/27/7/077404			JUL 2018	2018										1							WOS:000439127600004		
J	Ma, Xiaoyu; Reichhardt, C. J. O.; Reichhardt, C.								Manipulation of individual superconducting vortices and stick-slip motion in periodic pinning arrays								PHYSICAL REVIEW B				97	21					214521	10.1103/PhysRevB.97.214521			JUN 25 2018	2018										1							WOS:000436190900006		
J	Thiemann, Markus; Dressel, Martin; Scheffler, Marc								Complete electrodynamics of a BCS superconductor with mu eV energy scales: Microwave spectroscopy on titanium at mK temperatures								PHYSICAL REVIEW B				97	21					214516	10.1103/PhysRevB.97.214516			JUN 20 2018	2018										1							WOS:000435638000004		
J	Chiciak, Adam; Vitali, Ettore; Shi, Hao; Zhang, Shiwei								Magnetic orders in the hole-doped three-band Hubbard model: Spin spirals, nematicity, and ferromagnetic domain walls								PHYSICAL REVIEW B				97	23					235127	10.1103/PhysRevB.97.235127			JUN 15 2018	2018										1							WOS:000435346300001		
J	Wu, J.; Bollinger, A. T.; He, X.; Bozovic, I.								Pervasive electronic nematicity in a cuprate superconductor								PHYSICA C-SUPERCONDUCTIVITY AND ITS APPLICATIONS				549				95	98		10.1016/j.physc.2018.02.056			JUN 15 2018	2018						10th International Conference on Magnetic and Superconducting Materials (MSM)	SEP 18-21, 2017		Sharif Univ Technol, Tehran, IRAN	1							WOS:000432756700024		
J	Loret, B.; Gallais, Y.; Cazayous, M.; Zhong, R. D.; Schneeloch, J.; Gu, G. D.; Fedorov, A.; Kim, T. K.; Borisenko, S. V.; Sacuto, A.								Raman and ARPES combined study on the connection between the existence of the pseudogap and the topology of the Fermi surface in Bi2Sr2CaCu2O8+delta								PHYSICAL REVIEW B				97	17					174521	10.1103/PhysRevB.97.174521			MAY 30 2018	2018										1							WOS:000433419500003		
J	Wu, Shao-Feng; Wang, Bin; Ge, Xian-Hui; Tian, Yu								Collective diffusion and quantum chaos in holography								PHYSICAL REVIEW D				97	10					106018	10.1103/PhysRevD.97.106018			MAY 21 2018	2018										1							WOS:000433033900024		
J	Huang, H.; Jang, H.; Fujita, M.; Nishizaki, T.; Lin, Y.; Wang, J.; Ying, J.; Smith, J. S.; Kenney-Benson, C.; Shen, G.; Mao, W. L.; Kao, C. -C.; Liu, Y. -J.; Lee, J. -S.								Modification of structural disorder by hydrostatic pressure in the superconducting cuprate YBa2CU3O6.73								PHYSICAL REVIEW B				97	17					174508	10.1103/PhysRevB.97.174508			MAY 9 2018	2018										1							WOS:000432028500003		
J	Hussey, N. E.; Buhot, J.; Licciardello, S.								A tale of two metals: contrasting criticalities in the pnictides and hole-doped cuprates								REPORTS ON PROGRESS IN PHYSICS				81	5					052501	10.1088/1361-6633/aaa97c			MAY 2018	2018										1							WOS:000426920300001		
J	Heitzmann, Nicole; Fischer, Frank; Fischer, Martin R.								Worked examples with errors: when self-explanation prompts hinder learning of teachers diagnostic competences on problem-based learning								INSTRUCTIONAL SCIENCE				46	2			245	271		10.1007/s11251-017-9432-2			APR 2018	2018										1							WOS:000426722200003		
J	Myasnikova, A. E.; Zhileeva, E. A.; Moseykin, D., V								Relaxation of strongly coupled electron and phonon fields after photoemission and high-energy part of ARPES spectra of cuprates								JOURNAL OF PHYSICS-CONDENSED MATTER				30	12					125601	10.1088/1361-648X/aaad3e			MAR 28 2018	2018										1							WOS:000425973700001		
J	Atkinson, W. A.; Ufkes, S.; Kampf, A. P.								Structure of the charge density wave in cuprate superconductors: Lessons from NMR								PHYSICAL REVIEW B				97	12					125147	10.1103/PhysRevB.97.125147			MAR 26 2018	2018										1							WOS:000428239700008		
J	Howald, L.; Stilp, E.; Baiutti, F.; Dietl, C.; Wrobel, F.; Logvenov, G.; Prokscha, T.; Salman, Z.; Wooding, N.; Pavuna, D.; Keller, H.; Suter, A.								Unexpected effects of thickness and strain on superconductivity and magnetism in optimally doped La1.84Sr0.16CuO4 thin films								PHYSICAL REVIEW B				97	9					094514	10.1103/PhysRevB.97.094514			MAR 26 2018	2018										1							WOS:000428238000005		
J	Zhang, H.; Gauquelin, N.; McMahon, C.; Hawthorn, D. G.; Botton, G. A.; Wei, J. Y. T.								Synthesis of high-oxidation Y-Ba-Cu-O phases in superoxygenated thin films								PHYSICAL REVIEW MATERIALS				2	3					033803	10.1103/PhysRevMaterials.2.033803			MAR 26 2018	2018										1							WOS:000428244900004		
J	Putzke, Carsten; Ayres, Jake; Buhot, Jonathan; Licciardello, Salvatore; Hussey, Nigel E.; Friedemann, Sven; Carrington, Antony								Charge Order and Superconductivity in Underdoped YBa2Cu3O7-delta under Pressure								PHYSICAL REVIEW LETTERS				120	11					117002	10.1103/PhysRevLett.120.117002			MAR 16 2018	2018										1							WOS:000427642700009		
J	Jia, Yanli; He, Ge; Hu, Wei; Yang, Hua; Yang, Zhenzhong; Yu, Heshan; Zhang, Qinghua; Shi, Jinan; Lin, Zefeng; Yuan, Jie; Zhu, Beiyi; Gu, Lin; Li, Hong; Jin, Kui								The effects of oxygen in spinel oxide Li1+xTi2-xO4-delta thin films								SCIENTIFIC REPORTS				8						3995	10.1038/s41598-018-22393-8			MAR 5 2018	2018										1							WOS:000426540800028		
J	Saterskog, Petter								A framework for studying a quantum critical metal in the limit N-f -> 0								SCIPOST PHYSICS				4	3					015	10.21468/SciPostPhys.4.3.015			MAR 2018	2018										1							WOS:000432739600002		
J	Lawson, M.; Bush, B. T.; Kissikov, T.; Brubaker, Z.; Shirer, K. R.; Jeffries, J. R.; Ran, S.; Jeon, I.; Maple, M. B.; Curro, N. J.								Measurements of the NMR Knight shift tensor and nonlinear magnetization in URu2Si2								PHYSICAL REVIEW B				97	7					075138	10.1103/PhysRevB.97.075138			FEB 22 2018	2018										1							WOS:000425731700001		
J	Di Liberto, M.; Recati, A.; Trivedi, N.; Carusotto, I.; Menotti, C.								Particle-Hole Character of the Higgs and Goldstone Modes in Strongly Interacting Lattice Bosons								PHYSICAL REVIEW LETTERS				120	7					073201	10.1103/PhysRevLett.120.073201			FEB 15 2018	2018										1							WOS:000425094600002		
J	Brehm, John A.								Predicted bulk photovoltaic effect in hydrogenated Zintl compounds								JOURNAL OF MATERIALS CHEMISTRY C				6	6			1470	1475		10.1039/c7tc04091a			FEB 14 2018	2018										1							WOS:000424652000024		
J	Verma, Sanjeev K.; Gupta, Anushri; Kumari, Anita; Indu, B. D.								Superconducting gap anisotropy and d-wave pairing in YBa2Cu3O7-delta								INTERNATIONAL JOURNAL OF MODERN PHYSICS B				32	4					1850035	10.1142/S0217979218500352			FEB 10 2018	2018										1							WOS:000423843400007		
J	Ming, Fangfei; Smith, Tyler S.; Johnston, Steven; Snijders, Paul C.; Weitering, Hanno H.								Zero-bias anomaly in nanoscale hole-doped Mott insulators on a triangular silicon surface								PHYSICAL REVIEW B				97	7					075403	10.1103/PhysRevB.97.075403			FEB 5 2018	2018										1							WOS:000424088600005		
J	Liu, Shenghua; Zhang, Chunfeng; Deng, Qiang; Wen, Hai-hu; Li, Jian-xin; Chia, Elbert E. M.; Wang, Xiaoyong; Xiao, Min								Transient electronic anisotropy in overdoped NaFe1-xCoxAs superconductors								PHYSICAL REVIEW B				97	2					020505	10.1103/PhysRevB.97.020505			JAN 19 2018	2018										1							WOS:000423338300001		
J	Schuett, Michael; Orth, Peter P.; Levchenko, Alex; Fernandes, Rafael M.								Controlling competing orders via nonequilibrium acoustic phonons: Emergence of anisotropic effective electronic temperature								PHYSICAL REVIEW B				97	3					035135	10.1103/PhysRevB.97.035135			JAN 16 2018	2018										1							WOS:000423115200008		
