"Gold nanoparticle-doped biocompatible silk films as a path to implantable thermo-electrically wireless powering devices","Tao, Hu; Siebert, Sean M.; Brenckle, Mark A.; Averitt, Richard D.; Cronin-Golomb, Mark; Kaplan, David L.; Omenetto, Fiorenzo G.","","","","APPLIED PHYSICS LETTERS","SEP 20 2010","2010","97","12","","","","","","123702","10.1063/1.3486157","","","10","1.00","0","0","0","0","0","0","0","0","0","0","0","0","0","0","0","0","0","0","0","0","0","0","0","0","0","0","0","0","0","0","0","0","0","0","0","0","0","0","0","0","0","0","0","0","0","0","0","0","0","0","0","0","0","0","0","0","0","0","0","0","0","0","0","0","0","0","0","0","0","0","0","0","0","0","0","0","0","0","0","0","0","0","0","0","0","0","0","0","0","0","0","0","0","0","0","0","0","0","0","0","0","0","0","0","0","0","0","0","0","0","0","0","1","0","0","3","4","2","0","0"
"Optically induced lattice dynamics probed with ultrafast x-ray diffraction","Lee, H. J.; Workman, J.; Wark, J. S.; Averitt, R. D.; Taylor, A. J.; Roberts, J.; McCulloch, Q.; Hof, D. E.; Hur, N.; Cheong, S. -W.; Funk, D. J.","","","","PHYSICAL REVIEW B","APR 2008","2008","77","13","","","","","","132301","10.1103/PhysRevB.77.132301","","","10","0.83","0","0","0","0","0","0","0","0","0","0","0","0","0","0","0","0","0","0","0","0","0","0","0","0","0","0","0","0","0","0","0","0","0","0","0","0","0","0","0","0","0","0","0","0","0","0","0","0","0","0","0","0","0","0","0","0","0","0","0","0","0","0","0","0","0","0","0","0","0","0","0","0","0","0","0","0","0","0","0","0","0","0","0","0","0","0","0","0","0","0","0","0","0","0","0","0","0","0","0","0","0","0","0","0","0","0","0","0","0","3","0","0","0","1","1","0","3","0","2","0"
"Unambiguous chirp characterization using modified-spectrum auto-interferometric correlation and pulse spectrum","Yellampalle, B.; Averitt, R. D.; Taylor, A. J.","","","","OPTICS EXPRESS","SEP 18 2006","2006","14","19","","","","8890","8899","","10.1364/OE.14.008890","","","10","0.71","0","0","0","0","0","0","0","0","0","0","0","0","0","0","0","0","0","0","0","0","0","0","0","0","0","0","0","0","0","0","0","0","0","0","0","0","0","0","0","0","0","0","0","0","0","0","0","0","0","0","0","0","0","0","0","0","0","0","0","0","0","0","0","0","0","0","0","0","0","0","0","0","0","0","0","0","0","0","0","0","0","0","0","0","0","0","0","0","0","0","0","0","0","0","0","0","0","0","0","0","0","0","0","0","0","0","0","3","3","1","0","0","0","0","0","1","1","0","1","0"
"Spectral interferometric coherent Raman imaging","Yellampalle, B; Averitt, RD; Efimov, A; Taylor, AJ","","","","OPTICS EXPRESS","SEP 19 2005","2005","13","19","","","","7672","7682","","10.1364/OPEX.13.007672","","","10","0.67","0","0","0","0","0","0","0","0","0","0","0","0","0","0","0","0","0","0","0","0","0","0","0","0","0","0","0","0","0","0","0","0","0","0","0","0","0","0","0","0","0","0","0","0","0","0","0","0","0","0","0","0","0","0","0","0","0","0","0","0","0","0","0","0","0","0","0","0","0","0","0","0","0","0","0","0","0","0","0","0","0","0","0","0","0","0","0","0","0","0","0","0","0","0","0","0","0","0","0","0","0","0","0","0","0","0","2","4","1","2","0","1","0","0","0","0","0","0","0","0"
"Ultrafast terahertz field control of electronic and structural interactions in vanadium dioxide","Gray, A. X.; Hoffmann, M. C.; Jeong, J.; Aetukuri, N. P.; Zhu, D.; Hwang, H. Y.; Brandt, N. C.; Wen, H.; Sternbach, A. J.; Bonetti, S.; Reid, A. H.; Kukreja, R.; Graves, C.; Wang, T.; Granitzka, P.; Chen, Z.; Higley, D. J.; Chase, T.; Jal, E.; Abreu, E.; Liu, M. K.; Weng, T-C; Sokaras, D.; Nordlund, D.; Chollet, M.; Alonso-Mori, R.; Lemke, H.; Glownia, J. M.; Trigo, M.; Zhu, Y.; Ohldag, H.; Freeland, J. W.; Samant, M. G.; Berakdar, J.; Averitt, R. D.; Nelson, K. A.; Parkin, S. S. P.; Durr, H. A.","","","","PHYSICAL REVIEW B","JUL 2 2018","2018","98","4","","","","","","045104","10.1103/PhysRevB.98.045104","","","9","4.50","0","0","0","0","0","0","0","0","0","0","0","0","0","0","0","0","0","0","0","0","0","0","0","0","0","0","0","0","0","0","0","0","0","0","0","0","0","0","0","0","0","0","0","0","0","0","0","0","0","0","0","0","0","0","0","0","0","0","0","0","0","0","0","0","0","0","0","0","0","0","0","0","0","0","0","0","0","0","0","0","0","0","0","0","0","0","0","0","0","0","0","0","0","0","0","0","0","0","0","0","0","0","0","0","0","0","0","0","0","0","0","0","0","0","0","0","0","0","1","8"
"Coupled charge-spin dynamics of the magnetoresistive pyrochlore Tl2Mn2O7 probed using ultrafast midinfrared spectroscopy","Prasankumar, RP; Okamura, H; Imai, H; Shimakawa, Y; Kubo, Y; Trugman, SA; Taylor, AJ; Averitt, RD","","","","PHYSICAL REVIEW LETTERS","DEC 31 2005","2005","95","26","","","","","","267404","10.1103/PhysRevLett.95.267404","","","9","0.60","0","0","0","0","0","0","0","0","0","0","0","0","0","0","0","0","0","0","0","0","0","0","0","0","0","0","0","0","0","0","0","0","0","0","0","0","0","0","0","0","0","0","0","0","0","0","0","0","0","0","0","0","0","0","0","0","0","0","0","0","0","0","0","0","0","0","0","0","0","0","0","0","0","0","0","0","0","0","0","0","0","0","0","0","0","0","0","0","0","0","0","0","0","0","0","0","0","0","0","0","0","0","0","0","0","0","0","1","1","0","0","1","3","1","1","1","0","0","0","0"
"ON-LINE ELEMENTAL-REACTION ANALYZER AS AN ORGANIC ANALYSIS SYSTEM","LIEBMAN, SA; AHLSTROM, DH; NAUMAN, CD; AVERITT, R; WALKER, JL; LEVY, EJ","","","","ANALYTICAL CHEMISTRY","1973","1973","45","8","","","","1360","1364","","10.1021/ac60330a018","","","9","0.19","0","0","0","0","0","0","0","0","0","0","0","0","0","0","0","0","0","0","0","0","0","0","0","0","0","0","0","0","0","0","0","0","0","0","0","0","0","0","0","0","0","0","0","0","0","0","0","0","0","0","0","0","0","0","0","0","0","0","0","0","0","0","0","0","0","0","0","0","0","0","0","0","0","0","1","1","1","0","1","0","3","0","0","1","0","0","0","0","0","0","1","0","0","0","0","0","0","0","0","0","0","0","0","0","0","0","0","0","0","0","0","0","0","0","0","0","0","0","0","0"
"Terahertz radiation-induced sub-cycle field electron emission across a split-gap dipole antenna","Zhang, Jingdi; Zhao, Xiaoguang; Fan, Kebin; Wang, Xiaoning; Zhang, Gu-Feng; Geng, Kun; Zhang, Xin; Averitt, Richard D.","","","","APPLIED PHYSICS LETTERS","DEC 7 2015","2015","107","23","","","","","","231101","10.1063/1.4936841","","","8","1.60","0","0","0","0","0","0","0","0","0","0","0","0","0","0","0","0","0","0","0","0","0","0","0","0","0","0","0","0","0","0","0","0","0","0","0","0","0","0","0","0","0","0","0","0","0","0","0","0","0","0","0","0","0","0","0","0","0","0","0","0","0","0","0","0","0","0","0","0","0","0","0","0","0","0","0","0","0","0","0","0","0","0","0","0","0","0","0","0","0","0","0","0","0","0","0","0","0","0","0","0","0","0","0","0","0","0","0","0","0","0","0","0","0","0","0","0","2","0","4","2"
"Effects of Substrate Parameters on the Resonance Frequency of Double-sided SRR Structures under Two Different Excitations","Ekmekci, E.; Averitt, R. D.; Turhan-Sayan, G.","","","","PIERS 2010 CAMBRIDGE: PROGRESS IN ELECTROMAGNETICS RESEARCH SYMPOSIUM PROCEEDINGS, VOLS 1 AND 2","2010","2010","","","","","","538","+","","","Progress in Electromagnetics Research Symposium","JUL 05-08, 2010","8","0.80","0","0","0","0","0","0","0","0","0","0","0","0","0","0","0","0","0","0","0","0","0","0","0","0","0","0","0","0","0","0","0","0","0","0","0","0","0","0","0","0","0","0","0","0","0","0","0","0","0","0","0","0","0","0","0","0","0","0","0","0","0","0","0","0","0","0","0","0","0","0","0","0","0","0","0","0","0","0","0","0","0","0","0","0","0","0","0","0","0","0","0","0","0","0","0","0","0","0","0","0","0","0","0","0","0","0","0","0","0","0","0","2","1","1","1","0","0","2","1","0"
"Three envelope approach for ultrafast pulse characterization in a pump-probe experiment","Yellampalle, Balakishore; Chia, Elbert E. M.; Kim, Kiyong; Taylor, Antoinette J.; Averitt, Richard","","","","APPLIED PHYSICS LETTERS","FEB 11 2008","2008","92","6","","","","","","061111","10.1063/1.2837660","","","7","0.58","0","0","0","0","0","0","0","0","0","0","0","0","0","0","0","0","0","0","0","0","0","0","0","0","0","0","0","0","0","0","0","0","0","0","0","0","0","0","0","0","0","0","0","0","0","0","0","0","0","0","0","0","0","0","0","0","0","0","0","0","0","0","0","0","0","0","0","0","0","0","0","0","0","0","0","0","0","0","0","0","0","0","0","0","0","0","0","0","0","0","0","0","0","0","0","0","0","0","0","0","0","0","0","0","0","0","0","0","0","0","1","0","0","0","0","0","0","0","2","4"
"Tailoring the spectra of terahertz emission from CdTe and ZnTe electro-optic crystals","Yi, Minwoo; Lee, Kan-Hee; Maeng, Inhee; Son, Joo-Hiuk; Averitt, R. D.; Ahn, Jaewook","","","","JAPANESE JOURNAL OF APPLIED PHYSICS","JAN 2008","2008","47","1","1","","","202","204","","10.1143/JJAP.47.202","","","7","0.58","0","0","0","0","0","0","0","0","0","0","0","0","0","0","0","0","0","0","0","0","0","0","0","0","0","0","0","0","0","0","0","0","0","0","0","0","0","0","0","0","0","0","0","0","0","0","0","0","0","0","0","0","0","0","0","0","0","0","0","0","0","0","0","0","0","0","0","0","0","0","0","0","0","0","0","0","0","0","0","0","0","0","0","0","0","0","0","0","0","0","0","0","0","0","0","0","0","0","0","0","0","0","0","0","0","0","0","0","1","2","1","0","1","0","0","0","0","0","2","0"
"Dynamic coupling-decoupling crossover in the current-driven vortex state in Tl2Ba2CaCu2O8 probed by the Josephson plasma resonance","Thorsmolle, V. K.; Averitt, R. D.; Shibauchi, T.; Hundley, M. F.; Taylor, A. J.","","","","PHYSICAL REVIEW LETTERS","DEC 8 2006","2006","97","23","","","","","","237001","10.1103/PhysRevLett.97.237001","","","7","0.50","0","0","0","0","0","0","0","0","0","0","0","0","0","0","0","0","0","0","0","0","0","0","0","0","0","0","0","0","0","0","0","0","0","0","0","0","0","0","0","0","0","0","0","0","0","0","0","0","0","0","0","0","0","0","0","0","0","0","0","0","0","0","0","0","0","0","0","0","0","0","0","0","0","0","0","0","0","0","0","0","0","0","0","0","0","0","0","0","0","0","0","0","0","0","0","0","0","0","0","0","0","0","0","0","0","0","0","2","2","1","1","0","1","0","0","0","0","0","0","0"
"Nonequilibrium superconductivity probed by time-resolved far-infrared conductivity dynamics: Comparison between MgB2 and YBa2Cu3O7","Demsar, J; Averitt, RD; Taylor, AJ","","","","JOURNAL OF SUPERCONDUCTIVITY","FEB 2004","2004","17","1","","","","143","149","","10.1023/B:JOSC.0000011858.63802.26","","","7","0.44","0","0","0","0","0","0","0","0","0","0","0","0","0","0","0","0","0","0","0","0","0","0","0","0","0","0","0","0","0","0","0","0","0","0","0","0","0","0","0","0","0","0","0","0","0","0","0","0","0","0","0","0","0","0","0","0","0","0","0","0","0","0","0","0","0","0","0","0","0","0","0","0","0","0","0","0","0","0","0","0","0","0","0","0","0","0","0","0","0","0","0","0","0","0","0","0","0","0","0","0","0","0","0","0","1","1","1","0","0","0","0","1","0","0","0","2","0","1","0","0"
"ULTRAFAST LARGE DYNAMIC-RANGE SPECTROSCOPY","CHEVILLE, RA; AVERITT, RD; HALAS, NJ","","","","OPTICS COMMUNICATIONS","AUG 15 1994","1994","110","3-4","","","","327","333","","10.1016/0030-4018(94)90434-0","","","7","0.27","0","0","0","0","0","0","0","0","0","0","0","0","0","0","0","0","0","0","0","0","0","0","0","0","0","0","0","0","0","0","0","0","0","0","0","0","0","0","0","0","0","0","0","0","0","0","0","0","0","0","0","0","0","0","0","0","0","0","0","0","0","0","0","0","0","0","0","0","0","0","0","0","0","0","0","0","0","0","0","0","0","0","0","0","0","0","0","0","0","0","0","0","0","0","0","1","1","2","0","0","1","0","0","0","0","0","0","0","0","0","0","0","0","0","0","0","1","0","1","0"
"SYMMETRY BREAKING TRANSITIONS Dynamics of broken symmetry","Averitt, Richard D.","","","","NATURE PHYSICS","SEP 10 2010","2010","6","9","","","","639","640","","10.1038/nphys1768","","","6","0.60","0","0","0","0","0","0","0","0","0","0","0","0","0","0","0","0","0","0","0","0","0","0","0","0","0","0","0","0","0","0","0","0","0","0","0","0","0","0","0","0","0","0","0","0","0","0","0","0","0","0","0","0","0","0","0","0","0","0","0","0","0","0","0","0","0","0","0","0","0","0","0","0","0","0","0","0","0","0","0","0","0","0","0","0","0","0","0","0","0","0","0","0","0","0","0","0","0","0","0","0","0","0","0","0","0","0","0","0","0","0","0","1","4","0","1","0","0","0","0","0"
"Incorporation of fluorine in hydrogenated silicon carbide films deposited by pulsed glow discharge","Jacobsohn, LG; Afanasyev-Charkin, IV; Cooke, DW; Schulze, RK; Averitt, RD; Nastasi, M","","","","JOURNAL OF VACUUM SCIENCE & TECHNOLOGY A","JUL-AUG 2004","2004","22","4","","","","1223","1228","","10.1116/1.1764820","","","6","0.38","0","0","0","0","0","0","0","0","0","0","0","0","0","0","0","0","0","0","0","0","0","0","0","0","0","0","0","0","0","0","0","0","0","0","0","0","0","0","0","0","0","0","0","0","0","0","0","0","0","0","0","0","0","0","0","0","0","0","0","0","0","0","0","0","0","0","0","0","0","0","0","0","0","0","0","0","0","0","0","0","0","0","0","0","0","0","0","0","0","0","0","0","0","0","0","0","0","0","0","0","0","0","0","0","0","1","2","1","0","0","0","1","0","0","0","0","1","0","0","0"
"Femtosecond studies of mixed valence state formation in strongly correlated electron materials","Taylor, AJ; Averitt, RD; Demsar, J; Lobad, AI; Sarrao, JL; Trugman, SA","","","","PHYSICA B-CONDENSED MATTER","MAR 2002","2002","312","","","","","640","646","PII S0921-4526(01)01215-7","10.1016/S0921-4526(01)01215-7","International Conference on Strongly Correlated Electron Systems (SCES 01)","AUG 06-10, 2001","6","0.33","0","0","0","0","0","0","0","0","0","0","0","0","0","0","0","0","0","0","0","0","0","0","0","0","0","0","0","0","0","0","0","0","0","0","0","0","0","0","0","0","0","0","0","0","0","0","0","0","0","0","0","0","0","0","0","0","0","0","0","0","0","0","0","0","0","0","0","0","0","0","0","0","0","0","0","0","0","0","0","0","0","0","0","0","0","0","0","0","0","0","0","0","0","0","0","0","0","0","0","0","0","0","1","0","0","0","1","0","1","0","0","0","0","1","0","0","0","1","1","0"
"Terahertz metamaterial perfect absorber with continuously tunable air spacer layer","Schalch, Jacob; Duan, Guangwu; Zhao, Xiaoguang; Zhang, Xin; Averitt, Richard D.","","","","APPLIED PHYSICS LETTERS","AUG 6 2018","2018","113","6","","","","","","061113","10.1063/1.5041282","","","5","2.50","0","0","0","0","0","0","0","0","0","0","0","0","0","0","0","0","0","0","0","0","0","0","0","0","0","0","0","0","0","0","0","0","0","0","0","0","0","0","0","0","0","0","0","0","0","0","0","0","0","0","0","0","0","0","0","0","0","0","0","0","0","0","0","0","0","0","0","0","0","0","0","0","0","0","0","0","0","0","0","0","0","0","0","0","0","0","0","0","0","0","0","0","0","0","0","0","0","0","0","0","0","0","0","0","0","0","0","0","0","0","0","0","0","0","0","0","0","0","0","5"
"Time-resolved quasiparticle dynamics of the itinerant antiferromagnet UPtGa5","Chia, Elbert E. M.; Zhu, Jian-Xin; Talbayev, D.; Lee, H. J.; Hur, Namjung; Moreno, N. O.; Averitt, R. D.; Sarrao, J. L.; Taylor, A. J.","","","","PHYSICAL REVIEW B","NOV 11 2011","2011","84","17","","","","","","174412","10.1103/PhysRevB.84.174412","","","5","0.56","0","0","0","0","0","0","0","0","0","0","0","0","0","0","0","0","0","0","0","0","0","0","0","0","0","0","0","0","0","0","0","0","0","0","0","0","0","0","0","0","0","0","0","0","0","0","0","0","0","0","0","0","0","0","0","0","0","0","0","0","0","0","0","0","0","0","0","0","0","0","0","0","0","0","0","0","0","0","0","0","0","0","0","0","0","0","0","0","0","0","0","0","0","0","0","0","0","0","0","0","0","0","0","0","0","0","0","0","0","0","0","0","1","1","1","0","1","1","0","0"
"Terahertz metamaterial devices","Averitt, R. D.; Padilla, W. J.; Chen, H. T.; O'Hara, J. F.; Taylor, A. J.; Highstrete, C.; Lee, M.; Zide, J. M. O.; Bank, S. R.; Gossard, A. C.","","","Anwar, M; DeMaria, AJ; Shur, MS","TERAHERTZ PHYSICS, DEVICES, AND SYSTEMS II","2007","2007","6772","","","","","","","UNSP 677209","10.1117/12.751613","Conference on Terahertz Physics, Devices, and Systems II","SEP 11-12, 2007","5","0.38","0","0","0","0","0","0","0","0","0","0","0","0","0","0","0","0","0","0","0","0","0","0","0","0","0","0","0","0","0","0","0","0","0","0","0","0","0","0","0","0","0","0","0","0","0","0","0","0","0","0","0","0","0","0","0","0","0","0","0","0","0","0","0","0","0","0","0","0","0","0","0","0","0","0","0","0","0","0","0","0","0","0","0","0","0","0","0","0","0","0","0","0","0","0","0","0","0","0","0","0","0","0","0","0","0","0","0","0","0","0","0","0","1","0","2","0","0","1","0","1"
"The effect of interfacial roughness on the normal incidence bandgap of one-dimensional photonic crystals","Maskaly, KR; Carter, WC; Averitt, RD; Maxwell, JL","","","","OPTICS EXPRESS","OCT 17 2005","2005","13","21","","","","8380","8389","","10.1364/OPEX.13.008380","","","5","0.33","0","0","0","0","0","0","0","0","0","0","0","0","0","0","0","0","0","0","0","0","0","0","0","0","0","0","0","0","0","0","0","0","0","0","0","0","0","0","0","0","0","0","0","0","0","0","0","0","0","0","0","0","0","0","0","0","0","0","0","0","0","0","0","0","0","0","0","0","0","0","0","0","0","0","0","0","0","0","0","0","0","0","0","0","0","0","0","0","0","0","0","0","0","0","0","0","0","0","0","0","0","0","0","0","0","0","1","0","1","1","1","0","0","0","0","0","0","0","0","1"
"Boron-enhanced blistering and exfoliation in hydrogen-implanted SrTiO3","Lee, JK; Averitt, RD; Nastasi, M","","","","JOURNAL OF APPLIED PHYSICS","DEC 15 2004","2004","96","12","","","","7045","7051","","10.1063/1.1804623","","","5","0.31","0","0","0","0","0","0","0","0","0","0","0","0","0","0","0","0","0","0","0","0","0","0","0","0","0","0","0","0","0","0","0","0","0","0","0","0","0","0","0","0","0","0","0","0","0","0","0","0","0","0","0","0","0","0","0","0","0","0","0","0","0","0","0","0","0","0","0","0","0","0","0","0","0","0","0","0","0","0","0","0","0","0","0","0","0","0","0","0","0","0","0","0","0","0","0","0","0","0","0","0","0","0","0","0","0","1","0","0","0","0","1","0","0","0","0","0","1","1","1","0"
"Artifact free time resolved near-field spectroscopy","Sternbach, A. J.; Hinton, J.; Slusar, T.; Mcleod, A. S.; Liu, M. K.; Frenzel, A.; Wagner, M.; Iraheta, R.; Keilmann, F.; Leitenstorfer, A.; Fogler, M.; Kim, H. -T.; Averitt, R. D.; Basov, D. N.","","","","OPTICS EXPRESS","NOV 13 2017","2017","25","23","","","","28589","28611","","10.1364/OE.25.028589","","","4","1.33","0","0","0","0","0","0","0","0","0","0","0","0","0","0","0","0","0","0","0","0","0","0","0","0","0","0","0","0","0","0","0","0","0","0","0","0","0","0","0","0","0","0","0","0","0","0","0","0","0","0","0","0","0","0","0","0","0","0","0","0","0","0","0","0","0","0","0","0","0","0","0","0","0","0","0","0","0","0","0","0","0","0","0","0","0","0","0","0","0","0","0","0","0","0","0","0","0","0","0","0","0","0","0","0","0","0","0","0","0","0","0","0","0","0","0","0","0","0","2","2"
"TERAHERTZ METAMATERIALS WITH SIMULTANEOUSLY NEGATIVE ELECTRIC AND MAGNETIC RESONANCE RESPONSES BASED ON BIMATERIAL POP UP STRUCTURES","Tao, H.; Strikwerda, A.; Fan, K.; Padilla, W. J.; Averitt, R. D.; Zhang, X.","","","","IEEE 22ND INTERNATIONAL CONFERENCE ON MICRO ELECTRO MECHANICAL SYSTEMS (MEMS 2009)","2009","2009","","","","","","108","111","","10.1109/MEMSYS.2009.4805331","22nd International Conference on Micro Electro Mechanical Systems (MEMS)","JAN 25-29, 2009","4","0.36","0","0","0","0","0","0","0","0","0","0","0","0","0","0","0","0","0","0","0","0","0","0","0","0","0","0","0","0","0","0","0","0","0","0","0","0","0","0","0","0","0","0","0","0","0","0","0","0","0","0","0","0","0","0","0","0","0","0","0","0","0","0","0","0","0","0","0","0","0","0","0","0","0","0","0","0","0","0","0","0","0","0","0","0","0","0","0","0","0","0","0","0","0","0","0","0","0","0","0","0","0","0","0","0","0","0","0","0","0","0","2","1","0","0","1","0","0","0","0","0"
"Growth of thin Fe(001) films for terahertz emission experiments","Meserole, C. A.; Fisher, G. L.; Hilton, D. J.; Averitt, R. D.; Funk, D. J.; Taylor, A. J.","","","","APPLIED SURFACE SCIENCE","JUN 30 2007","2007","253","17","","","","6992","7003","","10.1016/j.apsusc.2007.02.029","","","4","0.31","0","0","0","0","0","0","0","0","0","0","0","0","0","0","0","0","0","0","0","0","0","0","0","0","0","0","0","0","0","0","0","0","0","0","0","0","0","0","0","0","0","0","0","0","0","0","0","0","0","0","0","0","0","0","0","0","0","0","0","0","0","0","0","0","0","0","0","0","0","0","0","0","0","0","0","0","0","0","0","0","0","0","0","0","0","0","0","0","0","0","0","0","0","0","0","0","0","0","0","0","0","0","0","0","0","0","0","0","0","0","0","0","0","1","0","1","1","0","1","0"
"Properties of dynamical electromagnetic metamaterials","Padilla, Willie J.; Averitt, Richard D.","","","","JOURNAL OF OPTICS","AUG 2017","2017","19","8","","","","","","084003","10.1088/2040-8986/aa728d","","","3","1.00","0","0","0","0","0","0","0","0","0","0","0","0","0","0","0","0","0","0","0","0","0","0","0","0","0","0","0","0","0","0","0","0","0","0","0","0","0","0","0","0","0","0","0","0","0","0","0","0","0","0","0","0","0","0","0","0","0","0","0","0","0","0","0","0","0","0","0","0","0","0","0","0","0","0","0","0","0","0","0","0","0","0","0","0","0","0","0","0","0","0","0","0","0","0","0","0","0","0","0","0","0","0","0","0","0","0","0","0","0","0","0","0","0","0","0","0","0","1","1","1"
"DESIGN, FABRICATION AND CHARACTERIZATION OF TUNABLE PERFECT ABSORBER ON FLEXIBLE SUBSTRATE","Zhao, X.; Fan, K.; Zhang, J.; Seren, H. R.; Metcalfe, G. D.; Wraback, M.; Averitt, R. D.; Zhang, X.","","","","2014 IEEE 27TH INTERNATIONAL CONFERENCE ON MICRO ELECTRO MECHANICAL SYSTEMS (MEMS)","2014","2014","","","","","","84","87","","","27th IEEE International Conference on Micro Electro Mechanical Systems (MEMS)","JAN 26-30, 2014","3","0.50","0","0","0","0","0","0","0","0","0","0","0","0","0","0","0","0","0","0","0","0","0","0","0","0","0","0","0","0","0","0","0","0","0","0","0","0","0","0","0","0","0","0","0","0","0","0","0","0","0","0","0","0","0","0","0","0","0","0","0","0","0","0","0","0","0","0","0","0","0","0","0","0","0","0","0","0","0","0","0","0","0","0","0","0","0","0","0","0","0","0","0","0","0","0","0","0","0","0","0","0","0","0","0","0","0","0","0","0","0","0","0","0","0","0","0","1","1","0","1","0"
"3D STAND-UP METAMATERIALS WITH A PURELY MAGNETIC RESONANCE AT TERAHERTZ FREQUENCIES","Fan, Kebin; Strikwerda, Andrew C.; Tao, Hu; Averitt, Richard D.; Zhang, Xin","","","","MEMS 2010: 23RD IEEE INTERNATIONAL CONFERENCE ON MICRO ELECTRO MECHANICAL SYSTEMS, TECHNICAL DIGEST","2010","2010","","","","","","843","846","","10.1109/MEMSYS.2010.5442338","23rd IEEE International Conference on Micro Electro Mechanical Systems (MEMS 2010)","JAN 24-28, 2010","3","0.30","0","0","0","0","0","0","0","0","0","0","0","0","0","0","0","0","0","0","0","0","0","0","0","0","0","0","0","0","0","0","0","0","0","0","0","0","0","0","0","0","0","0","0","0","0","0","0","0","0","0","0","0","0","0","0","0","0","0","0","0","0","0","0","0","0","0","0","0","0","0","0","0","0","0","0","0","0","0","0","0","0","0","0","0","0","0","0","0","0","0","0","0","0","0","0","0","0","0","0","0","0","0","0","0","0","0","0","0","0","0","1","1","1","0","0","0","0","0","0","0"
"Application of the homogenization approximation to rough one-dimensional photonic crystals","Maskaly, KR; Carter, WC; Averitt, RD; Maxwell, JL","","","","OPTICS LETTERS","NOV 1 2005","2005","30","21","","","","2930","2932","","10.1364/OL.30.002930","","","3","0.20","0","0","0","0","0","0","0","0","0","0","0","0","0","0","0","0","0","0","0","0","0","0","0","0","0","0","0","0","0","0","0","0","0","0","0","0","0","0","0","0","0","0","0","0","0","0","0","0","0","0","0","0","0","0","0","0","0","0","0","0","0","0","0","0","0","0","0","0","0","0","0","0","0","0","0","0","0","0","0","0","0","0","0","0","0","0","0","0","0","0","0","0","0","0","0","0","0","0","0","0","0","0","0","0","0","0","1","0","1","1","0","0","0","0","0","0","0","0","0","0"
"CHROMATOGRAPHIC STOP-FLOW FOR TRACE ORGANIC ANALYSIS","LIEBMAN, SA; LEVY, EJ; AHLSTROM, DH; AVERITT, R; PRUDER, GD; NAUMAN, CD","","","","RESEARCH-DEVELOPMENT","1972","1972","23","12","","","","24","&","","","","","3","0.06","0","0","0","0","0","0","0","0","0","0","0","0","0","0","0","0","0","0","0","0","0","0","0","0","0","0","0","0","0","0","0","0","0","0","0","0","0","0","0","0","0","0","0","0","0","0","0","0","0","0","0","0","0","0","0","0","0","0","0","0","0","0","0","0","0","0","0","0","0","0","0","0","0","0","0","0","1","0","0","0","0","0","1","0","0","0","0","1","0","0","0","0","0","0","0","0","0","0","0","0","0","0","0","0","0","0","0","0","0","0","0","0","0","0","0","0","0","0","0","0"
"Ultrafast quasiparticle dynamics in the correlated semimetal Ca3Ru2O7","Yuan, Yakun; Kissin, Peter; Puggioni, Danilo; Cremin, Kevin; Lei, Shiming; Wang, Yu; Mao, Zhiqiang; Rondinelli, James M.; Averitt, Richard D.; Gopalan, Venkatraman","","","","PHYSICAL REVIEW B","APR 4 2019","2019","99","15","","","","","","155111","10.1103/PhysRevB.99.155111","","","2","2.00","0","0","0","0","0","0","0","0","0","0","0","0","0","0","0","0","0","0","0","0","0","0","0","0","0","0","0","0","0","0","0","0","0","0","0","0","0","0","0","0","0","0","0","0","0","0","0","0","0","0","0","0","0","0","0","0","0","0","0","0","0","0","0","0","0","0","0","0","0","0","0","0","0","0","0","0","0","0","0","0","0","0","0","0","0","0","0","0","0","0","0","0","0","0","0","0","0","0","0","0","0","0","0","0","0","0","0","0","0","0","0","0","0","0","0","0","0","0","0","2"
