"THz materials discovery and integration: the search for novel functionality","Seren, Huseyin R.; Keiser, George R.; Zhang, Jingdi; Maddox, Scott; Zhao, Xiaoguang; Fan, Kebin; Bank, Seth; Zhang, Xin; Averitt, Richard D.","","","","2015 40TH INTERNATIONAL CONFERENCE ON INFRARED, MILLIMETER AND TERAHERTZ WAVES (IRMMW-THZ)","2015","2015","","","","","","","","","","40th International Conference on Infrared, Millimeter, and Terahertz Waves (IRMMW-THz)","AUG 23-28, 2015","0","0.00","0","0","0","0","0","0","0","0","0","0","0","0","0","0","0","0","0","0","0","0","0","0","0","0","0","0","0","0","0","0","0","0","0","0","0","0","0","0","0","0","0","0","0","0","0","0","0","0","0","0","0","0","0","0","0","0","0","0","0","0","0","0","0","0","0","0","0","0","0","0","0","0","0","0","0","0","0","0","0","0","0","0","0","0","0","0","0","0","0","0","0","0","0","0","0","0","0","0","0","0","0","0","0","0","0","0","0","0","0","0","0","0","0","0","0","0","0","0","0","0"
"Time-resolved quasiparticle dynamics of the itinerant antiferromagnet UPtGa5 (vol 84, pg 174412, 2011)","Chia, Elbert E. M.; Zhu, Jian-Xin; Talbayev, D.; Lee, H. J.; Hur, Namjung; Moreno, N. O.; Averitt, R. D.; Sarrao, J. L.; Taylor, A. J.","","","","PHYSICAL REVIEW B","SEP 9 2013","2013","88","9","","","","","","099901","10.1103/PhysRevB.88.099901","","","0","0.00","0","0","0","0","0","0","0","0","0","0","0","0","0","0","0","0","0","0","0","0","0","0","0","0","0","0","0","0","0","0","0","0","0","0","0","0","0","0","0","0","0","0","0","0","0","0","0","0","0","0","0","0","0","0","0","0","0","0","0","0","0","0","0","0","0","0","0","0","0","0","0","0","0","0","0","0","0","0","0","0","0","0","0","0","0","0","0","0","0","0","0","0","0","0","0","0","0","0","0","0","0","0","0","0","0","0","0","0","0","0","0","0","0","0","0","0","0","0","0","0"
"Metamaterial-Enhanced Nonlinear Terahertz Spectroscopy","Hwang, H. Y.; Liu, M.; Fan, K.; Zhang, J.; Strikwerda, A. C.; Sternbach, A.; Brandt, N. C.; Perkins, B. G.; Zhang, X.; Averitt, R. D.; Nelson, K. A.","","","Chergui, M; Taylor, A; Cundiff, S; DeVivieRiedle, R; Yamagouchi, K","XVIIITH INTERNATIONAL CONFERENCE ON ULTRAFAST PHENOMENA","2013","2013","41","","","","","","","UNSP 09005","10.1051/epjconf/20134109005","18th International Conference on Ultrafast Phenomena","JUL 08-13, 2012","0","0.00","0","0","0","0","0","0","0","0","0","0","0","0","0","0","0","0","0","0","0","0","0","0","0","0","0","0","0","0","0","0","0","0","0","0","0","0","0","0","0","0","0","0","0","0","0","0","0","0","0","0","0","0","0","0","0","0","0","0","0","0","0","0","0","0","0","0","0","0","0","0","0","0","0","0","0","0","0","0","0","0","0","0","0","0","0","0","0","0","0","0","0","0","0","0","0","0","0","0","0","0","0","0","0","0","0","0","0","0","0","0","0","0","0","0","0","0","0","0","0","0"
"Metamaterial-Enhanced Nonlinear Responses in Semiconductors as a THz Detection Platform","Hwang, Harold Y.; Fan, Kebin; Sternbach, Aaron; Zhang, Xin; Averitt, Richard D.; Nelson, Keith A.","","","","2013 CONFERENCE ON LASERS AND ELECTRO-OPTICS (CLEO)","2013","2013","","","","","","","","","","Conference on Lasers and Electro-Optics (CLEO)","JUN 09-14, 2013","0","0.00","0","0","0","0","0","0","0","0","0","0","0","0","0","0","0","0","0","0","0","0","0","0","0","0","0","0","0","0","0","0","0","0","0","0","0","0","0","0","0","0","0","0","0","0","0","0","0","0","0","0","0","0","0","0","0","0","0","0","0","0","0","0","0","0","0","0","0","0","0","0","0","0","0","0","0","0","0","0","0","0","0","0","0","0","0","0","0","0","0","0","0","0","0","0","0","0","0","0","0","0","0","0","0","0","0","0","0","0","0","0","0","0","0","0","0","0","0","0","0","0"
"Fully Implantable and Resorbable Metamaterials","Tao, H.; Hwang, S.; Liu, M.; Panilaitis, B.; Brenckle, M. A.; Kaplan, D. L.; Averitt, R. D.; Rogers, J. A.; Omenetto, F. G.","","","","2012 CONFERENCE ON LASERS AND ELECTRO-OPTICS (CLEO)","2012","2012","","","","","","","","","","Conference on Lasers and Electro-Optics (CLEO)","MAY 06-11, 2012","0","0.00","0","0","0","0","0","0","0","0","0","0","0","0","0","0","0","0","0","0","0","0","0","0","0","0","0","0","0","0","0","0","0","0","0","0","0","0","0","0","0","0","0","0","0","0","0","0","0","0","0","0","0","0","0","0","0","0","0","0","0","0","0","0","0","0","0","0","0","0","0","0","0","0","0","0","0","0","0","0","0","0","0","0","0","0","0","0","0","0","0","0","0","0","0","0","0","0","0","0","0","0","0","0","0","0","0","0","0","0","0","0","0","0","0","0","0","0","0","0","0","0"
"METAMATERIALS A stamp of quality","Averitt, Richard D.","","","","NATURE NANOTECHNOLOGY","JUL 2011","2011","6","7","","","","396","397","","10.1038/nnano.2011.109","","","0","0.00","0","0","0","0","0","0","0","0","0","0","0","0","0","0","0","0","0","0","0","0","0","0","0","0","0","0","0","0","0","0","0","0","0","0","0","0","0","0","0","0","0","0","0","0","0","0","0","0","0","0","0","0","0","0","0","0","0","0","0","0","0","0","0","0","0","0","0","0","0","0","0","0","0","0","0","0","0","0","0","0","0","0","0","0","0","0","0","0","0","0","0","0","0","0","0","0","0","0","0","0","0","0","0","0","0","0","0","0","0","0","0","0","0","0","0","0","0","0","0","0"
"BROADBAND TUNABLE 3D METAMATERIALS AT TERAHERTZ FREQUENCIES","Fan, Kebin; Strikwerda, Andrew C.; Tao, Hu; Averitt, Richard D.; Zhang, Xin","","","","2011 IEEE 24TH INTERNATIONAL CONFERENCE ON MICRO ELECTRO MECHANICAL SYSTEMS (MEMS)","2011","2011","","","","","","680","683","","","24th IEEE International Conference on Micro Electro Mechanical Systems (MEMS)","JAN 23-27, 2011","0","0.00","0","0","0","0","0","0","0","0","0","0","0","0","0","0","0","0","0","0","0","0","0","0","0","0","0","0","0","0","0","0","0","0","0","0","0","0","0","0","0","0","0","0","0","0","0","0","0","0","0","0","0","0","0","0","0","0","0","0","0","0","0","0","0","0","0","0","0","0","0","0","0","0","0","0","0","0","0","0","0","0","0","0","0","0","0","0","0","0","0","0","0","0","0","0","0","0","0","0","0","0","0","0","0","0","0","0","0","0","0","0","0","0","0","0","0","0","0","0","0","0"
"Frequency Tunable Metamaterial Designs Using Near Field Coupled SRR Structures in the Terahertz Region","Ekmeki, Evren; Strikwerda, Andrew C.; Fan, Kebin; Keiser, George; Zhang, Xin; Turhan-Sayan, Gonul; Averitt, Richard D.","","","Koch, M","2011 36TH INTERNATIONAL CONFERENCE ON INFRARED, MILLIMETER, AND TERAHERTZ WAVES (IRMMW-THZ)","2011","2011","","","","","","","","","","36th International Conference on Infrared, Millimeter, and Terahertz Waves (IRMMW-THz)","OCT 02-07, 2011","0","0.00","0","0","0","0","0","0","0","0","0","0","0","0","0","0","0","0","0","0","0","0","0","0","0","0","0","0","0","0","0","0","0","0","0","0","0","0","0","0","0","0","0","0","0","0","0","0","0","0","0","0","0","0","0","0","0","0","0","0","0","0","0","0","0","0","0","0","0","0","0","0","0","0","0","0","0","0","0","0","0","0","0","0","0","0","0","0","0","0","0","0","0","0","0","0","0","0","0","0","0","0","0","0","0","0","0","0","0","0","0","0","0","0","0","0","0","0","0","0","0","0"
"A Tunable 3D Terahertz Metamaterial","Fan, Kebin; Strikwerda, Andrew C.; Tao, Hu; Zhang, Xin; Averitt, Richard D.","","","Koch, M","2011 36TH INTERNATIONAL CONFERENCE ON INFRARED, MILLIMETER, AND TERAHERTZ WAVES (IRMMW-THZ)","2011","2011","","","","","","","","","","36th International Conference on Infrared, Millimeter, and Terahertz Waves (IRMMW-THz)","OCT 02-07, 2011","0","0.00","0","0","0","0","0","0","0","0","0","0","0","0","0","0","0","0","0","0","0","0","0","0","0","0","0","0","0","0","0","0","0","0","0","0","0","0","0","0","0","0","0","0","0","0","0","0","0","0","0","0","0","0","0","0","0","0","0","0","0","0","0","0","0","0","0","0","0","0","0","0","0","0","0","0","0","0","0","0","0","0","0","0","0","0","0","0","0","0","0","0","0","0","0","0","0","0","0","0","0","0","0","0","0","0","0","0","0","0","0","0","0","0","0","0","0","0","0","0","0","0"
"Direct measurement of the THz near-magnetic field of metamaterial elements","Kumar, Nishant; Strikwerda, Andrew; Fan, Kebin; Zhang, Xin; Averitt, Richard; Planken, Paul; Adam, Aurele","","","Koch, M","2011 36TH INTERNATIONAL CONFERENCE ON INFRARED, MILLIMETER, AND TERAHERTZ WAVES (IRMMW-THZ)","2011","2011","","","","","","","","","","36th International Conference on Infrared, Millimeter, and Terahertz Waves (IRMMW-THz)","OCT 02-07, 2011","0","0.00","0","0","0","0","0","0","0","0","0","0","0","0","0","0","0","0","0","0","0","0","0","0","0","0","0","0","0","0","0","0","0","0","0","0","0","0","0","0","0","0","0","0","0","0","0","0","0","0","0","0","0","0","0","0","0","0","0","0","0","0","0","0","0","0","0","0","0","0","0","0","0","0","0","0","0","0","0","0","0","0","0","0","0","0","0","0","0","0","0","0","0","0","0","0","0","0","0","0","0","0","0","0","0","0","0","0","0","0","0","0","0","0","0","0","0","0","0","0","0","0"
"Large Strain-Induced Conductivity Anisotropy in VO2 Thin Films, Probed by THz Spectroscopy","Liu, Mengkun; Abreu, Elsa; Lu, Jiwei; West, Kevin G.; Kittiwatanakul, Salinport; Yin, Wenjing; Wolf, Stuart; Averitt, Richard D.","","","Koch, M","2011 36TH INTERNATIONAL CONFERENCE ON INFRARED, MILLIMETER, AND TERAHERTZ WAVES (IRMMW-THZ)","2011","2011","","","","","","","","","","36th International Conference on Infrared, Millimeter, and Terahertz Waves (IRMMW-THz)","OCT 02-07, 2011","0","0.00","0","0","0","0","0","0","0","0","0","0","0","0","0","0","0","0","0","0","0","0","0","0","0","0","0","0","0","0","0","0","0","0","0","0","0","0","0","0","0","0","0","0","0","0","0","0","0","0","0","0","0","0","0","0","0","0","0","0","0","0","0","0","0","0","0","0","0","0","0","0","0","0","0","0","0","0","0","0","0","0","0","0","0","0","0","0","0","0","0","0","0","0","0","0","0","0","0","0","0","0","0","0","0","0","0","0","0","0","0","0","0","0","0","0","0","0","0","0","0","0"
"Metamaterial Based Terahertz Detector","Strikwerda, Andrew C.; Tao, Hu; Kadlec, Emil A.; Fan, Kebin; Padilla, Willie J.; Averitt, Richard D.; Shaner, Eric A.; Zhang, Xin","","","Koch, M","2011 36TH INTERNATIONAL CONFERENCE ON INFRARED, MILLIMETER, AND TERAHERTZ WAVES (IRMMW-THZ)","2011","2011","","","","","","","","","","36th International Conference on Infrared, Millimeter, and Terahertz Waves (IRMMW-THz)","OCT 02-07, 2011","0","0.00","0","0","0","0","0","0","0","0","0","0","0","0","0","0","0","0","0","0","0","0","0","0","0","0","0","0","0","0","0","0","0","0","0","0","0","0","0","0","0","0","0","0","0","0","0","0","0","0","0","0","0","0","0","0","0","0","0","0","0","0","0","0","0","0","0","0","0","0","0","0","0","0","0","0","0","0","0","0","0","0","0","0","0","0","0","0","0","0","0","0","0","0","0","0","0","0","0","0","0","0","0","0","0","0","0","0","0","0","0","0","0","0","0","0","0","0","0","0","0","0"
"Terahertz Metamaterials: Recent Developments and New Opportunities","Averitt, Richard D.","","","","2011 CONFERENCE ON LASERS AND ELECTRO-OPTICS (CLEO)","2011","2011","","","","","","","","","","Conference on Lasers and Electro-Optics (CLEO)","MAY 01-06, 2011","0","0.00","0","0","0","0","0","0","0","0","0","0","0","0","0","0","0","0","0","0","0","0","0","0","0","0","0","0","0","0","0","0","0","0","0","0","0","0","0","0","0","0","0","0","0","0","0","0","0","0","0","0","0","0","0","0","0","0","0","0","0","0","0","0","0","0","0","0","0","0","0","0","0","0","0","0","0","0","0","0","0","0","0","0","0","0","0","0","0","0","0","0","0","0","0","0","0","0","0","0","0","0","0","0","0","0","0","0","0","0","0","0","0","0","0","0","0","0","0","0","0","0"
"Frequency Tunable Metamaterial Designs Using Near Field Coupled SRR Structures in the Terahertz Region","Ekmekci, Evren; Strikwerda, A. C.; Fan, K.; Keiser, G.; Zhang, Xin; Turhan-Sayan, G.; Averitt, Richard D.","","","","2011 CONFERENCE ON LASERS AND ELECTRO-OPTICS (CLEO)","2011","2011","","","","","","","","","","Conference on Lasers and Electro-Optics (CLEO)","MAY 01-06, 2011","0","0.00","0","0","0","0","0","0","0","0","0","0","0","0","0","0","0","0","0","0","0","0","0","0","0","0","0","0","0","0","0","0","0","0","0","0","0","0","0","0","0","0","0","0","0","0","0","0","0","0","0","0","0","0","0","0","0","0","0","0","0","0","0","0","0","0","0","0","0","0","0","0","0","0","0","0","0","0","0","0","0","0","0","0","0","0","0","0","0","0","0","0","0","0","0","0","0","0","0","0","0","0","0","0","0","0","0","0","0","0","0","0","0","0","0","0","0","0","0","0","0","0"
"Large Strain-Induced Conductivity Anisotropy in VO2 Thin Films Probed by THz Spectroscopy","Liu, Mengkun; Abreu, Elsa; Lu, Jiwei; West, Kevin G.; Kittiwatanakul, Salinporn; Yin, Wenjing; Wolf, Stuart; Averitt, Richard D.","","","","2011 CONFERENCE ON LASERS AND ELECTRO-OPTICS (CLEO)","2011","2011","","","","","","","","","","Conference on Lasers and Electro-Optics (CLEO)","MAY 01-06, 2011","0","0.00","0","0","0","0","0","0","0","0","0","0","0","0","0","0","0","0","0","0","0","0","0","0","0","0","0","0","0","0","0","0","0","0","0","0","0","0","0","0","0","0","0","0","0","0","0","0","0","0","0","0","0","0","0","0","0","0","0","0","0","0","0","0","0","0","0","0","0","0","0","0","0","0","0","0","0","0","0","0","0","0","0","0","0","0","0","0","0","0","0","0","0","0","0","0","0","0","0","0","0","0","0","0","0","0","0","0","0","0","0","0","0","0","0","0","0","0","0","0","0","0"
"Metamaterial Based Terahertz Detector","Strikwerda, Andrew C.; Tao, Hu; Kadlec, Emil A.; Fan, Kebin; Padilla, Willie J.; Zhang, Xin; Shaner, Eric A.; Averitt, Richard D.","","","","2011 CONFERENCE ON LASERS AND ELECTRO-OPTICS (CLEO)","2011","2011","","","","","","","","","","Conference on Lasers and Electro-Optics (CLEO)","MAY 01-06, 2011","0","0.00","0","0","0","0","0","0","0","0","0","0","0","0","0","0","0","0","0","0","0","0","0","0","0","0","0","0","0","0","0","0","0","0","0","0","0","0","0","0","0","0","0","0","0","0","0","0","0","0","0","0","0","0","0","0","0","0","0","0","0","0","0","0","0","0","0","0","0","0","0","0","0","0","0","0","0","0","0","0","0","0","0","0","0","0","0","0","0","0","0","0","0","0","0","0","0","0","0","0","0","0","0","0","0","0","0","0","0","0","0","0","0","0","0","0","0","0","0","0","0","0"
"3D Stand-up Metamaterials With A Purely Magnetic Resonance At Terahertz Frequencies","Fan, K.; Strikwerda, A. C.; Tao, H.; Zhang, X.; Averitt, R. D.","","","","2010 CONFERENCE ON LASERS AND ELECTRO-OPTICS (CLEO) AND QUANTUM ELECTRONICS AND LASER SCIENCE CONFERENCE (QELS)","2010","2010","","","","","","","","","","Conference on Lasers and Electro-Optics (CLEO)/Quantum Electronics and Laser Science Conference (QELS)","MAY 16-21, 2010","0","0.00","0","0","0","0","0","0","0","0","0","0","0","0","0","0","0","0","0","0","0","0","0","0","0","0","0","0","0","0","0","0","0","0","0","0","0","0","0","0","0","0","0","0","0","0","0","0","0","0","0","0","0","0","0","0","0","0","0","0","0","0","0","0","0","0","0","0","0","0","0","0","0","0","0","0","0","0","0","0","0","0","0","0","0","0","0","0","0","0","0","0","0","0","0","0","0","0","0","0","0","0","0","0","0","0","0","0","0","0","0","0","0","0","0","0","0","0","0","0","0","0"
"Structurally Reconfigurable Metamaterials at Terahertz Frequencies","Tao, H.; Strikwerda, A.; Fan, K.; Padilla, W. J.; Zhang, X.; Averitt, R. D.","","","","2010 CONFERENCE ON LASERS AND ELECTRO-OPTICS (CLEO) AND QUANTUM ELECTRONICS AND LASER SCIENCE CONFERENCE (QELS)","2010","2010","","","","","","","","","","Conference on Lasers and Electro-Optics (CLEO)/Quantum Electronics and Laser Science Conference (QELS)","MAY 16-21, 2010","0","0.00","0","0","0","0","0","0","0","0","0","0","0","0","0","0","0","0","0","0","0","0","0","0","0","0","0","0","0","0","0","0","0","0","0","0","0","0","0","0","0","0","0","0","0","0","0","0","0","0","0","0","0","0","0","0","0","0","0","0","0","0","0","0","0","0","0","0","0","0","0","0","0","0","0","0","0","0","0","0","0","0","0","0","0","0","0","0","0","0","0","0","0","0","0","0","0","0","0","0","0","0","0","0","0","0","0","0","0","0","0","0","0","0","0","0","0","0","0","0","0","0"
"The interaction of THz phonon-polariton waves with microstructures observed using quantitative, phase-sensitive imaging","Werley, Christopher A.; Fan, Kebin; Strikwerda, Andrew C.; Wu, Qiang; Lin, Kung-Hsuan; Averitt, Richard D.; Nelson, Keith A.","","","","2009 34TH INTERNATIONAL CONFERENCE ON INFRARED, MILLIMETER, AND TERAHERTZ WAVES, VOLS 1 AND 2","2009","2009","","","","","","696","+","","","34th International Conference on Infrared, Millimeter, and Terahertz Waves (IRMMW-THz 2009)","SEP 21-25, 2009","0","0.00","0","0","0","0","0","0","0","0","0","0","0","0","0","0","0","0","0","0","0","0","0","0","0","0","0","0","0","0","0","0","0","0","0","0","0","0","0","0","0","0","0","0","0","0","0","0","0","0","0","0","0","0","0","0","0","0","0","0","0","0","0","0","0","0","0","0","0","0","0","0","0","0","0","0","0","0","0","0","0","0","0","0","0","0","0","0","0","0","0","0","0","0","0","0","0","0","0","0","0","0","0","0","0","0","0","0","0","0","0","0","0","0","0","0","0","0","0","0","0","0"
"Flexible Terahertz Metamaterials On Polyimide Substrates","Tao, H.; Strikwerda, A.; Fan, K.; Bingham, C. M.; Padilla, W. J.; Zhang, X.; Averitt, R. D.","","","","2009 CONFERENCE ON LASERS AND ELECTRO-OPTICS AND QUANTUM ELECTRONICS AND LASER SCIENCE CONFERENCE (CLEO/QELS 2009), VOLS 1-5","2009","2009","","","","","","968","+","","","Conference on Lasers and Electro-Optics/Quantum Electronics and Laser Science Conference (CLEO/QELS 2009)","JUN 02-04, 2009","0","0.00","0","0","0","0","0","0","0","0","0","0","0","0","0","0","0","0","0","0","0","0","0","0","0","0","0","0","0","0","0","0","0","0","0","0","0","0","0","0","0","0","0","0","0","0","0","0","0","0","0","0","0","0","0","0","0","0","0","0","0","0","0","0","0","0","0","0","0","0","0","0","0","0","0","0","0","0","0","0","0","0","0","0","0","0","0","0","0","0","0","0","0","0","0","0","0","0","0","0","0","0","0","0","0","0","0","0","0","0","0","0","0","0","0","0","0","0","0","0","0","0"
"Flexible Wide Angle Terahertz Resonant Absorber Based On Perfectly Impedance Matched Metamaterials","Tao, H.; Bingham, C. M.; Strikwerda, A.; Pilon, D.; Shrekenhamer, D.; Landy, N. I.; Fan, K.; Padilla, W. J.; Zhang, X.; Averitt, R. D.","","","","2009 CONFERENCE ON LASERS AND ELECTRO-OPTICS AND QUANTUM ELECTRONICS AND LASER SCIENCE CONFERENCE (CLEO/QELS 2009), VOLS 1-5","2009","2009","","","","","","970","+","","","Conference on Lasers and Electro-Optics/Quantum Electronics and Laser Science Conference (CLEO/QELS 2009)","JUN 02-04, 2009","0","0.00","0","0","0","0","0","0","0","0","0","0","0","0","0","0","0","0","0","0","0","0","0","0","0","0","0","0","0","0","0","0","0","0","0","0","0","0","0","0","0","0","0","0","0","0","0","0","0","0","0","0","0","0","0","0","0","0","0","0","0","0","0","0","0","0","0","0","0","0","0","0","0","0","0","0","0","0","0","0","0","0","0","0","0","0","0","0","0","0","0","0","0","0","0","0","0","0","0","0","0","0","0","0","0","0","0","0","0","0","0","0","0","0","0","0","0","0","0","0","0","0"
"Comparison of Birefringent Metamaterials and Meanderline Structure as Quarter-Wave Plates at Terahertz Frequencies","Strikwerda, Andrew C.; Fan, Kebin; Tao, Hu; Pilon, Daniel V.; Zhang, Xin; Averitt, Richard D.","","","","2009 CONFERENCE ON LASERS AND ELECTRO-OPTICS AND QUANTUM ELECTRONICS AND LASER SCIENCE CONFERENCE (CLEO/QELS 2009), VOLS 1-5","2009","2009","","","","","","976","+","","","Conference on Lasers and Electro-Optics/Quantum Electronics and Laser Science Conference (CLEO/QELS 2009)","JUN 02-04, 2009","0","0.00","0","0","0","0","0","0","0","0","0","0","0","0","0","0","0","0","0","0","0","0","0","0","0","0","0","0","0","0","0","0","0","0","0","0","0","0","0","0","0","0","0","0","0","0","0","0","0","0","0","0","0","0","0","0","0","0","0","0","0","0","0","0","0","0","0","0","0","0","0","0","0","0","0","0","0","0","0","0","0","0","0","0","0","0","0","0","0","0","0","0","0","0","0","0","0","0","0","0","0","0","0","0","0","0","0","0","0","0","0","0","0","0","0","0","0","0","0","0","0","0"
"A Broadband Terahertz Metamaterial Electrical Modulator","Chen, Hou-Tong; Padilla, Willie J.; Cich, Michael J.; Azad, Abu K.; Averitt, Richard D.; Taylor, Antoinette J.","","","","2009 CONFERENCE ON LASERS AND ELECTRO-OPTICS AND QUANTUM ELECTRONICS AND LASER SCIENCE CONFERENCE (CLEO/QELS 2009), VOLS 1-5","2009","2009","","","","","","1201","+","","","Conference on Lasers and Electro-Optics/Quantum Electronics and Laser Science Conference (CLEO/QELS 2009)","JUN 02-04, 2009","0","0.00","0","0","0","0","0","0","0","0","0","0","0","0","0","0","0","0","0","0","0","0","0","0","0","0","0","0","0","0","0","0","0","0","0","0","0","0","0","0","0","0","0","0","0","0","0","0","0","0","0","0","0","0","0","0","0","0","0","0","0","0","0","0","0","0","0","0","0","0","0","0","0","0","0","0","0","0","0","0","0","0","0","0","0","0","0","0","0","0","0","0","0","0","0","0","0","0","0","0","0","0","0","0","0","0","0","0","0","0","0","0","0","0","0","0","0","0","0","0","0","0"
"External Modulation of Terahertz Quantum Cascade Lasers Using Electrically-Driven Active Metamaterials","Peralta, X. G.; Brener, I.; Padilla, W. J.; Young, E. W.; Hoffman, A. J.; Cich, M. J.; Averitt, R. D.; Wanke, M. C.; Wright, J. B.; Chen, H. -T.; O'Hara, J. F.; Taylor, A. J.; Waldman, J.; Goodhue, W. D.; Li, J.","","","","2009 CONFERENCE ON LASERS AND ELECTRO-OPTICS AND QUANTUM ELECTRONICS AND LASER SCIENCE CONFERENCE (CLEO/QELS 2009), VOLS 1-5","2009","2009","","","","","","1205","+","","","Conference on Lasers and Electro-Optics/Quantum Electronics and Laser Science Conference (CLEO/QELS 2009)","JUN 02-04, 2009","0","0.00","0","0","0","0","0","0","0","0","0","0","0","0","0","0","0","0","0","0","0","0","0","0","0","0","0","0","0","0","0","0","0","0","0","0","0","0","0","0","0","0","0","0","0","0","0","0","0","0","0","0","0","0","0","0","0","0","0","0","0","0","0","0","0","0","0","0","0","0","0","0","0","0","0","0","0","0","0","0","0","0","0","0","0","0","0","0","0","0","0","0","0","0","0","0","0","0","0","0","0","0","0","0","0","0","0","0","0","0","0","0","0","0","0","0","0","0","0","0","0","0"
"Conductivity Dynamics in the Correlated Metallic State of V2O3","Liu, M.; Pardo, B.; Qazilbash, M. M.; Yun, S. J.; Chae, B. G.; Kim, B. J.; Basov, D. N.; Averitt, R. D.","","","","2009 CONFERENCE ON LASERS AND ELECTRO-OPTICS AND QUANTUM ELECTRONICS AND LASER SCIENCE CONFERENCE (CLEO/QELS 2009), VOLS 1-5","2009","2009","","","","","","2132","+","","","Conference on Lasers and Electro-Optics/Quantum Electronics and Laser Science Conference (CLEO/QELS 2009)","JUN 02-04, 2009","0","0.00","0","0","0","0","0","0","0","0","0","0","0","0","0","0","0","0","0","0","0","0","0","0","0","0","0","0","0","0","0","0","0","0","0","0","0","0","0","0","0","0","0","0","0","0","0","0","0","0","0","0","0","0","0","0","0","0","0","0","0","0","0","0","0","0","0","0","0","0","0","0","0","0","0","0","0","0","0","0","0","0","0","0","0","0","0","0","0","0","0","0","0","0","0","0","0","0","0","0","0","0","0","0","0","0","0","0","0","0","0","0","0","0","0","0","0","0","0","0","0","0"
"Dynamic investigations of multiferroics: terahertz and beyond","Talbayev, D.; LaForge, A. D.; Hur, N.; Kimura, T.; Trugman, S. A.; Balatsky, A. V.; Basov, D. N.; Taylor, A. J.; Averitt, R. D.","","","Tanaka, K; Ogawa, T; Hashimoto, H; Koshihara, S","LXIII YAMADA CONFERENCE ON PHOTO-INDUCED PHASE TRANSITION AND COOPERATIVE PHENOMENA (PIPT3)","2009","2009","148","","","","","","","012037","10.1088/1742-6596/148/1/012037","63rd Yamada Conference on Photo-Induced Phase Transition and Cooperative Phenomena (PIPT3)","NOV 11-15, 2008","0","0.00","0","0","0","0","0","0","0","0","0","0","0","0","0","0","0","0","0","0","0","0","0","0","0","0","0","0","0","0","0","0","0","0","0","0","0","0","0","0","0","0","0","0","0","0","0","0","0","0","0","0","0","0","0","0","0","0","0","0","0","0","0","0","0","0","0","0","0","0","0","0","0","0","0","0","0","0","0","0","0","0","0","0","0","0","0","0","0","0","0","0","0","0","0","0","0","0","0","0","0","0","0","0","0","0","0","0","0","0","0","0","0","0","0","0","0","0","0","0","0","0"
"Dynamic Metamaterials at Terahertz Frequencies","Chen, H. T.; Azad, Abul K.; O'Hara, J. F.; Taylor, A. J.; Padilla, W. J.; Averitt, R. D.","","","Corkum, P; DeSilvestri, S; Nelson, KA; Riedle, E","ULTRAFAST PHENOMENA XVI","2009","2009","92","","","","","645","+","","","16th International Conference on Ultrafast Phenomena","JUN 09-13, 2008","0","0.00","0","0","0","0","0","0","0","0","0","0","0","0","0","0","0","0","0","0","0","0","0","0","0","0","0","0","0","0","0","0","0","0","0","0","0","0","0","0","0","0","0","0","0","0","0","0","0","0","0","0","0","0","0","0","0","0","0","0","0","0","0","0","0","0","0","0","0","0","0","0","0","0","0","0","0","0","0","0","0","0","0","0","0","0","0","0","0","0","0","0","0","0","0","0","0","0","0","0","0","0","0","0","0","0","0","0","0","0","0","0","0","0","0","0","0","0","0","0","0","0"
"Probing nanoscale inhomogeneities in transition metal oxides with ultrafast mid-infrared spectroscopy","Prasankumar, R. P.; Lee, H. J.; Okamura, H.; Imai, H.; Shimakawa, Y.; Kubo, Y.; Zvyagin, S.; Kamenev, K.; Balakrishnan, G.; Paulf, D. Mck.; Trugman, S. A.; Taylor, A. J.; Averitt, R. D.","","","","PHYSICA B-CONDENSED MATTER","APR 1 2008","2008","403","5-9","","","","1401","1403","","10.1016/j.physb.2007.10.186","International Conference on Strongly Correlated Electron Systems (SCES 2007)","MAY 13-18, 2007","0","0.00","0","0","0","0","0","0","0","0","0","0","0","0","0","0","0","0","0","0","0","0","0","0","0","0","0","0","0","0","0","0","0","0","0","0","0","0","0","0","0","0","0","0","0","0","0","0","0","0","0","0","0","0","0","0","0","0","0","0","0","0","0","0","0","0","0","0","0","0","0","0","0","0","0","0","0","0","0","0","0","0","0","0","0","0","0","0","0","0","0","0","0","0","0","0","0","0","0","0","0","0","0","0","0","0","0","0","0","0","0","0","0","0","0","0","0","0","0","0","0","0"
